
[0;36m════════════════════════════════════════[0m
[0;36m  Step 0: Validating Prerequisites[0m
[0;36m════════════════════════════════════════[0m
[0;32m[SUCCESS][0m All required tools found
[0;32m[SUCCESS][0m SiliconData credentials configured
[0;32m[SUCCESS][0m Vast.ai API key configured

[0;36m════════════════════════════════════════[0m
[0;36m  Step 1: Get Machine ID[0m
[0;36m════════════════════════════════════════[0m
[0;34m[INFO][0m Using machine ID from argument: 39209
[0;32m[SUCCESS][0m Target machine ID: 39209

[0;36m════════════════════════════════════════[0m
[0;36m  Step 2: Finding Offer for Machine 39209[0m
[0;36m════════════════════════════════════════[0m
[0;34m[INFO][0m Searching for available offers on machine 39209...
[0;32m[SUCCESS][0m Found offer:
  [0;36mOffer ID:[0m     24450408
  [0;36mGPU:[0m          1 x A100 SXM4
  [0;36mDLPerf:[0m       94.29573119937139
  [0;36mPrice:[0m        $0.6699074074074074/hr
  [0;36mLocation:[0m     Texas, US
  [0;36mHost ID:[0m      33081
[0;34m[INFO][0m Proceeding automatically to rent this instance...

[0;36m════════════════════════════════════════[0m
[0;36m  Step 3: Creating SiliconMark Job[0m
[0;36m════════════════════════════════════════[0m
[0;34m[INFO][0m Job name: quickmark-machine-39209-20251202-162211
[0;34m[INFO][0m Logging into SiliconData as tojaigupta@gmail.com...
[0;32m[SUCCESS][0m Got SiliconData auth token
[0;34m[INFO][0m Creating SiliconMark job...
[0;32m[SUCCESS][0m SiliconMark job created
  [0;36mJob ID:[0m    1995981872060047360
  [0;36mAPI Key:[0m   eyJhbGciOiJIUzI1NiIsImtpZCI6IlNpbGljb25f...

[0;36m════════════════════════════════════════[0m
[0;36m  Step 4: Creating Vast.ai Instance[0m
[0;36m════════════════════════════════════════[0m
[0;34m[INFO][0m Creating instance from offer 24450408...
[0;34m[INFO][0m Using image: vastai/pytorch
{
 "new_contract": 28442936,
 "success": true
}
[0;32m[SUCCESS][0m Instance created: 28442936

[0;36m════════════════════════════════════════[0m
[0;36m  Step 5: Waiting for Instance to be Ready[0m
[0;36m════════════════════════════════════════[0m

[0;34m[INFO][0m Status changed to: unknown
  [0;36m⏱[0m  Waiting: [1;33m  0s[0m / 300s | Status: [1;33munknown[0m      [0;36m⏱[0m  Waiting: [1;33m  1s[0m / 300s | Status: [1;33munknown[0m      [0;36m⏱[0m  Waiting: [1;33m  2s[0m / 300s | Status: [1;33munknown[0m      [0;36m⏱[0m  Waiting: [1;33m  3s[0m / 300s | Status: [1;33munknown[0m      [0;36m⏱[0m  Waiting: [1;33m  4s[0m / 300s | Status: [1;33munknown[0m      [0;36m⏱[0m  Waiting: [1;33m  5s[0m / 300s | Status: [1;33munknown[0m      [0;36m⏱[0m  Waiting: [1;33m  6s[0m / 300s | Status: [1;33munknown[0m      [0;36m⏱[0m  Waiting: [1;33m  7s[0m / 300s | Status: [1;33munknown[0m      [0;36m⏱[0m  Waiting: [1;33m  8s[0m / 300s | Status: [1;33munknown[0m      [0;36m⏱[0m  Waiting: [1;33m  9s[0m / 300s | Status: [1;33munknown[0m      [0;36m⏱[0m  Waiting: [1;33m 10s[0m / 300s | Status: [1;33munknown[0m      [0;36m⏱[0m  Waiting: [1;33m 11s[0m / 300s | Status: [1;33munknown[0m      [0;36m⏱[0m  Waiting: [1;33m 12s[0m / 300s | Status: [1;33munknown[0m      [0;36m⏱[0m  Waiting: [1;33m 13s[0m / 300s | Status: [1;33munknown[0m      [0;36m⏱[0m  Waiting: [1;33m 14s[0m / 300s | Status: [1;33munknown[0m      [0;36m⏱[0m  Waiting: [1;33m 15s[0m / 300s | Status: [1;33munknown[0m      [0;36m⏱[0m  Waiting: [1;33m 16s[0m / 300s | Status: [1;33munknown[0m      [0;36m⏱[0m  Waiting: [1;33m 17s[0m / 300s | Status: [1;33munknown[0m      [0;36m⏱[0m  Waiting: [1;33m 18s[0m / 300s | Status: [1;33munknown[0m      [0;36m⏱[0m  Waiting: [1;33m 19s[0m / 300s | Status: [1;33munknown[0m    
[0;34m[INFO][0m Status changed to: loading
  [0;36m⏱[0m  Waiting: [1;33m 20s[0m / 300s | Status: [1;33mloading[0m      [0;36m⏱[0m  Waiting: [1;33m 21s[0m / 300s | Status: [1;33mloading[0m      [0;36m⏱[0m  Waiting: [1;33m 22s[0m / 300s | Status: [1;33mloading[0m      [0;36m⏱[0m  Waiting: [1;33m 23s[0m / 300s | Status: [1;33mloading[0m      [0;36m⏱[0m  Waiting: [1;33m 24s[0m / 300s | Status: [1;33mloading[0m      [0;36m⏱[0m  Waiting: [1;33m 25s[0m / 300s | Status: [1;33mloading[0m      [0;36m⏱[0m  Waiting: [1;33m 26s[0m / 300s | Status: [1;33mloading[0m      [0;36m⏱[0m  Waiting: [1;33m 27s[0m / 300s | Status: [1;33mloading[0m      [0;36m⏱[0m  Waiting: [1;33m 28s[0m / 300s | Status: [1;33mloading[0m      [0;36m⏱[0m  Waiting: [1;33m 29s[0m / 300s | Status: [1;33mloading[0m    
[0;34m[INFO][0m Status changed to: running

[0;32m[SUCCESS][0m Instance is running!

[0;34m[INFO][0m Waiting for benchmark to complete (running in startup script)...
[0;34m[INFO][0m Monitoring logs for 'QUICKMARK_BENCHMARK_COMPLETE' message...
[0;34m[INFO][0m This typically takes 5-10 minutes...

waiting on logs for instance 28442936 fetching from https://s3.amazonaws.com/public.vast.ai/instance_logs/74192c11119ba63b8616926d93061a43.log
waiting on logs for instance 28442936 fetching from https://s3.amazonaws.com/public.vast.ai/instance_logs/74192c11119ba63b8616926d93061a43.log
Tue Dec  2 22:22:43 UTC 2025
Hit:1 https://developer.download.nvidia.com/compute/cuda/repos/ubuntu2204/x86_64  InRelease
Hit:2 http://archive.ubuntu.com/ubuntu jammy InRelease
Hit:3 http://security.ubuntu.com/ubuntu jammy-security InRelease
Hit:4 http://archive.ubuntu.com/ubuntu jammy-updates InRelease
Hit:5 http://archive.ubuntu.com/ubuntu jammy-backports InRelease
Hit:6 https://ppa.launchpadcontent.net/deadsnakes/nightly/ubuntu jammy InRelease
Hit:7 https://ppa.launchpadcontent.net/deadsnakes/ppa/ubuntu jammy InRelease
Reading package lists...
Reading package lists...
Building dependency tree...
Reading state information...
curl is already the newest version (7.81.0-1ubuntu1.21).
less is already the newest version (590-1ubuntu0.22.04.3).
locales is already the newest version (2.35-0ubuntu3.11).
openssh-server is already the newest version (1:8.9p1-3ubuntu0.13).
software-properties-common is already the newest version (0.99.22.9).
sudo is already the newest version (1.9.9-1ubuntu2.5).
tmux is already the newest version (3.2a-4ubuntu0.2).
wget is already the newest version (1.21.2-2ubuntu1.1).
0 upgraded, 0 newly installed, 0 to remove and 122 not upgraded.
Reading package lists...
Building dependency tree...
Reading state information...
git is already the newest version (1:2.34.1-1ubuntu1.15).
rsync is already the newest version (3.2.7-0ubuntu0.22.04.4).
0 upgraded, 0 newly installed, 0 to remove and 122 not upgraded.
rm: cannot remove '/etc/forward_port2': No such file or directory
+ echo '=== QuickMark Setup Starting ==='
=== QuickMark Setup Starting ===
+ apt-get update
Server listening on 0.0.0.0 port 22.
Server listening on :: port 22.
Tue Dec  2 22:22:50 UTC 2025
Hit:1 https://developer.download.nvidia.com/compute/cuda/repos/ubuntu2204/x86_64  InRelease
Warning: Permanently added 'ssh3.vast.ai' (ED25519) to the list of known hosts.
Hit:2 http://archive.ubuntu.com/ubuntu jammy InRelease
Hit:3 http://security.ubuntu.com/ubuntu jammy-security InRelease
Hit:4 http://archive.ubuntu.com/ubuntu jammy-updates InRelease
Hit:5 http://archive.ubuntu.com/ubuntu jammy-backports InRelease
Hit:6 https://ppa.launchpadcontent.net/deadsnakes/nightly/ubuntu jammy InRelease
Hit:7 https://ppa.launchpadcontent.net/deadsnakes/ppa/ubuntu jammy InRelease
  [0;36m⏱[0m  Monitoring logs: [1;33m  0s[0m / 900s | Log lines: [1;33m44[0m      [0;36m⏱[0m  Monitoring logs: [1;33m  1s[0m / 900s | Log lines: [1;33m44[0m      [0;36m⏱[0m  Monitoring logs: [1;33m  2s[0m / 900s | Log lines: [1;33m44[0m      [0;36m⏱[0m  Monitoring logs: [1;33m  3s[0m / 900s | Log lines: [1;33m44[0m      [0;36m⏱[0m  Monitoring logs: [1;33m  4s[0m / 900s | Log lines: [1;33m44[0m      [0;36m⏱[0m  Monitoring logs: [1;33m  5s[0m / 900s | Log lines: [1;33m44[0m      [0;36m⏱[0m  Monitoring logs: [1;33m  6s[0m / 900s | Log lines: [1;33m44[0m      [0;36m⏱[0m  Monitoring logs: [1;33m  7s[0m / 900s | Log lines: [1;33m44[0m      [0;36m⏱[0m  Monitoring logs: [1;33m  8s[0m / 900s | Log lines: [1;33m44[0m      [0;36m⏱[0m  Monitoring logs: [1;33m  9s[0m / 900s | Log lines: [1;33m44[0m    
+ apt-get install -y libgpgme11 wget
Reading package lists...
Building dependency tree...
Reading state information...
wget is already the newest version (1.21.2-2ubuntu1.1).
The following NEW packages will be installed:
  libgpgme11
0 upgraded, 1 newly installed, 0 to remove and 122 not upgraded.
Need to get 136 kB of archives.
After this operation, 381 kB of additional disk space will be used.
Get:1 http://archive.ubuntu.com/ubuntu jammy-updates/main amd64 libgpgme11 amd64 1.16.0-1.2ubuntu4.2 [136 kB]
debconf: delaying package configuration, since apt-utils is not installed
Fetched 136 kB in 1s (226 kB/s)
Selecting previously unselected package libgpgme11:amd64.
(Reading database ... (Reading database ... 5%(Reading database ... 10%(Reading database ... 15%(Reading database ... 20%(Reading database ... 25%(Reading database ... 30%(Reading database ... 35%(Reading database ... 40%(Reading database ... 45%(Reading database ... 50%(Reading database ... 55%(Reading database ... 60%(Reading database ... 65%(Reading database ... 70%(Reading database ... 75%(Reading database ... 80%(Reading database ... 85%(Reading database ... 90%(Reading d
Preparing to unpack .../libgpgme11_1.16.0-1.2ubuntu4.2_amd64.deb ...
Unpacking libgpgme11:amd64 (1.16.0-1.2ubuntu4.2) ...
Setting up libgpgme11:amd64 (1.16.0-1.2ubuntu4.2) ...
Processing triggers for libc-bin (2.35-0ubuntu3.9) ...
+ pip3 install pynvml
Collecting pynvml
  Downloading pynvml-13.0.1-py3-none-any.whl (28 kB)
Collecting nvidia-ml-py>=12.0.0
  Downloading nvidia_ml_py-13.580.82-py3-none-any.whl (49 kB)
     ━━━━━━━━━━━━━━━━━━━━━━━━━━━━━━━━━━━━━━━━ 49.0/49.0 KB 13.2 MB/s eta 0:00:00
Installing collected packages: nvidia-ml-py, pynvml
Successfully installed nvidia-ml-py-13.580.82 pynvml-13.0.1
WARNING: Running pip as the 'root' user can result in broken permissions and conflicting behaviour with the system package manager. It is recommended to use a virtual environment instead: https://pip.pypa.io/warnings/venv
+ pip3 install torch
Collecting torch
  Downloading torch-2.9.1-cp310-cp310-manylinux_2_28_x86_64.whl (899.8 MB)
  [0;36m⏱[0m  Monitoring logs: [1;33m 10s[0m / 900s | Log lines: [1;33m75[0m      [0;36m⏱[0m  Monitoring logs: [1;33m 11s[0m / 900s | Log lines: [1;33m75[0m      [0;36m⏱[0m  Monitoring logs: [1;33m 12s[0m / 900s | Log lines: [1;33m75[0m      [0;36m⏱[0m  Monitoring logs: [1;33m 13s[0m / 900s | Log lines: [1;33m75[0m      [0;36m⏱[0m  Monitoring logs: [1;33m 14s[0m / 900s | Log lines: [1;33m75[0m      [0;36m⏱[0m  Monitoring logs: [1;33m 15s[0m / 900s | Log lines: [1;33m75[0m      [0;36m⏱[0m  Monitoring logs: [1;33m 16s[0m / 900s | Log lines: [1;33m75[0m      [0;36m⏱[0m  Monitoring logs: [1;33m 17s[0m / 900s | Log lines: [1;33m75[0m      [0;36m⏱[0m  Monitoring logs: [1;33m 18s[0m / 900s | Log lines: [1;33m75[0m      [0;36m⏱[0m  Monitoring logs: [1;33m 19s[0m / 900s | Log lines: [1;33m75[0m    
  Downloading torch-2.9.1-cp310-cp310-manylinux_2_28_x86_64.whl (899.8 MB)
     ━━━━━━━━━━━━━━━━━━━━━━━━━━━━━━━━━━━━━━━ 899.8/899.8 MB 3.7 MB/s eta 0:00:00
Collecting filelock
  Downloading filelock-3.20.0-py3-none-any.whl (16 kB)
Collecting nvidia-cuda-runtime-cu12==12.8.90
  Downloading nvidia_cuda_runtime_cu12-12.8.90-py3-none-manylinux2014_x86_64.manylinux_2_17_x86_64.whl (954 kB)
     ━━━━━━━━━━━━━━━━━━━━━━━━━━━━━━━━━━━━━ 954.8/954.8 KB 104.9 MB/s eta 0:00:00
Collecting nvidia-curand-cu12==10.3.9.90
  Downloading nvidia_curand_cu12-10.3.9.90-py3-none-manylinux_2_27_x86_64.whl (63.6 MB)
     ━━━━━━━━━━━━━━━━━━━━━━━━━━━━━━━━━━━━━━━━ 63.6/63.6 MB 36.9 MB/s eta 0:00:00
Collecting nvidia-cublas-cu12==12.8.4.1
  Downloading nvidia_cublas_cu12-12.8.4.1-py3-none-manylinux_2_27_x86_64.whl (594.3 MB)
  [0;36m⏱[0m  Monitoring logs: [1;33m 20s[0m / 900s | Log lines: [1;33m87[0m      [0;36m⏱[0m  Monitoring logs: [1;33m 21s[0m / 900s | Log lines: [1;33m87[0m      [0;36m⏱[0m  Monitoring logs: [1;33m 22s[0m / 900s | Log lines: [1;33m87[0m      [0;36m⏱[0m  Monitoring logs: [1;33m 23s[0m / 900s | Log lines: [1;33m87[0m      [0;36m⏱[0m  Monitoring logs: [1;33m 24s[0m / 900s | Log lines: [1;33m87[0m      [0;36m⏱[0m  Monitoring logs: [1;33m 25s[0m / 900s | Log lines: [1;33m87[0m      [0;36m⏱[0m  Monitoring logs: [1;33m 26s[0m / 900s | Log lines: [1;33m87[0m      [0;36m⏱[0m  Monitoring logs: [1;33m 27s[0m / 900s | Log lines: [1;33m87[0m      [0;36m⏱[0m  Monitoring logs: [1;33m 28s[0m / 900s | Log lines: [1;33m87[0m      [0;36m⏱[0m  Monitoring logs: [1;33m 29s[0m / 900s | Log lines: [1;33m87[0m    
     ━━━━━━━━━━━━━━━━━━━━━━━━━━━━━━━━━━━━━━━ 594.3/594.3 MB 5.4 MB/s eta 0:00:00
Collecting nvidia-cufile-cu12==1.13.1.3
  Downloading nvidia_cufile_cu12-1.13.1.3-py3-none-manylinux2014_x86_64.manylinux_2_17_x86_64.whl (1.2 MB)
     ━━━━━━━━━━━━━━━━━━━━━━━━━━━━━━━━━━━━━━━━ 1.2/1.2 MB 97.2 MB/s eta 0:00:00
Collecting nvidia-cuda-cupti-cu12==12.8.90
  Downloading nvidia_cuda_cupti_cu12-12.8.90-py3-none-manylinux2014_x86_64.manylinux_2_17_x86_64.whl (10.2 MB)
     ━━━━━━━━━━━━━━━━━━━━━━━━━━━━━━━━━━━━━━━━ 10.2/10.2 MB 82.8 MB/s eta 0:00:00
Collecting nvidia-cusolver-cu12==11.7.3.90
  Downloading nvidia_cusolver_cu12-11.7.3.90-py3-none-manylinux_2_27_x86_64.whl (267.5 MB)
     ━━━━━━━━━━━━━━━━━━━━━━━━━━━━━━━━━━━━━━ 267.5/267.5 MB 10.7 MB/s eta 0:00:00
Collecting nvidia-nvtx-cu12==12.8.90
  Downloading nvidia_nvtx_cu12-12.8.90-py3-none-manylinux2014_x86_64.manylinux_2_17_x86_64.whl (89 kB)
     ━━━━━━━━━━━━━━━━━━━━━━━━━━━━━━━━━━━━━━━━ 90.0/90.0 KB 45.2 MB/s eta 0:00:00
Collecting sympy>=1.13.3
  Downloading sympy-1.14.0-py3-none-any.whl (6.3 MB)
     ━━━━━━━━━━━━━━━━━━━━━━━━━━━━━━━━━━━━━━━━ 6.3/6.3 MB 94.7 MB/s eta 0:00:00
Collecting nvidia-nccl-cu12==2.27.5
  Downloading nvidia_nccl_cu12-2.27.5-py3-none-manylinux2014_x86_64.manylinux_2_17_x86_64.whl (322.3 MB)
  [0;36m⏱[0m  Monitoring logs: [1;33m 30s[0m / 900s | Log lines: [1;33m105[0m      [0;36m⏱[0m  Monitoring logs: [1;33m 31s[0m / 900s | Log lines: [1;33m105[0m      [0;36m⏱[0m  Monitoring logs: [1;33m 32s[0m / 900s | Log lines: [1;33m105[0m      [0;36m⏱[0m  Monitoring logs: [1;33m 33s[0m / 900s | Log lines: [1;33m105[0m      [0;36m⏱[0m  Monitoring logs: [1;33m 34s[0m / 900s | Log lines: [1;33m105[0m      [0;36m⏱[0m  Monitoring logs: [1;33m 35s[0m / 900s | Log lines: [1;33m105[0m      [0;36m⏱[0m  Monitoring logs: [1;33m 36s[0m / 900s | Log lines: [1;33m105[0m      [0;36m⏱[0m  Monitoring logs: [1;33m 37s[0m / 900s | Log lines: [1;33m105[0m      [0;36m⏱[0m  Monitoring logs: [1;33m 38s[0m / 900s | Log lines: [1;33m105[0m      [0;36m⏱[0m  Monitoring logs: [1;33m 39s[0m / 900s | Log lines: [1;33m105[0m      [0;36m⏱[0m  Monitoring logs: [1;33m 40s[0m / 900s | Log lines: [1;33m31[0m      [0;36m⏱[0m  Monitoring logs: [1;33m 41s[0m / 900s | Log lines: [1;33m31[0m      [0;36m⏱[0m  Monitoring logs: [1;33m 42s[0m / 900s | Log lines: [1;33m31[0m      [0;36m⏱[0m  Monitoring logs: [1;33m 43s[0m / 900s | Log lines: [1;33m31[0m      [0;36m⏱[0m  Monitoring logs: [1;33m 44s[0m / 900s | Log lines: [1;33m31[0m      [0;36m⏱[0m  Monitoring logs: [1;33m 45s[0m / 900s | Log lines: [1;33m31[0m      [0;36m⏱[0m  Monitoring logs: [1;33m 46s[0m / 900s | Log lines: [1;33m31[0m      [0;36m⏱[0m  Monitoring logs: [1;33m 47s[0m / 900s | Log lines: [1;33m31[0m      [0;36m⏱[0m  Monitoring logs: [1;33m 48s[0m / 900s | Log lines: [1;33m31[0m      [0;36m⏱[0m  Monitoring logs: [1;33m 49s[0m / 900s | Log lines: [1;33m31[0m    
Collecting nvidia-nccl-cu12==2.27.5
  Downloading nvidia_nccl_cu12-2.27.5-py3-none-manylinux2014_x86_64.manylinux_2_17_x86_64.whl (322.3 MB)
     ━━━━━━━━━━━━━━━━━━━━━━━━━━━━━━━━━━━━━━━ 322.3/322.3 MB 8.4 MB/s eta 0:00:00
Collecting nvidia-cuda-nvrtc-cu12==12.8.93
  Downloading nvidia_cuda_nvrtc_cu12-12.8.93-py3-none-manylinux2010_x86_64.manylinux_2_12_x86_64.whl (88.0 MB)
     ━━━━━━━━━━━━━━━━━━━━━━━━━━━━━━━━━━━━━━━━ 88.0/88.0 MB 27.8 MB/s eta 0:00:00
Requirement already satisfied: jinja2 in /usr/local/lib/python3.10/dist-packages (from torch) (3.1.6)
Collecting networkx>=2.5.1
  Downloading networkx-3.4.2-py3-none-any.whl (1.7 MB)
     ━━━━━━━━━━━━━━━━━━━━━━━━━━━━━━━━━━━━━━━━ 1.7/1.7 MB 105.0 MB/s eta 0:00:00
Collecting fsspec>=0.8.5
  Downloading fsspec-2025.10.0-py3-none-any.whl (200 kB)
     ━━━━━━━━━━━━━━━━━━━━━━━━━━━━━━━━━━━━━━ 201.0/201.0 KB 84.1 MB/s eta 0:00:00
Collecting nvidia-cudnn-cu12==9.10.2.21
  Downloading nvidia_cudnn_cu12-9.10.2.21-py3-none-manylinux_2_27_x86_64.whl (706.8 MB)
     ━━━━━━━━━━━━━━━━━━━━━━━━━━━━━━━━━━━━━━━ 706.8/706.8 MB 4.4 MB/s eta 0:00:00
Collecting triton==3.5.1
  Downloading triton-3.5.1-cp310-cp310-manylinux_2_27_x86_64.manylinux_2_28_x86_64.whl (170.3 MB)
     ━━━━━━━━━━━━━━━━━━━━━━━━━━━━━━━━━━━━━━ 170.3/170.3 MB 16.5 MB/s eta 0:00:00
Collecting nvidia-cusparse-cu12==12.5.8.93
  Downloading nvidia_cusparse_cu12-12.5.8.93-py3-none-manylinux2014_x86_64.manylinux_2_17_x86_64.whl (288.2 MB)
     ━━━━━━━━━━━━━━━━━━━━━━━━━━━━━━━━━━━━━━ 288.2/288.2 MB 10.7 MB/s eta 0:00:00
Requirement already satisfied: typing-extensions>=4.10.0 in /usr/local/lib/python3.10/dist-packages (from torch) (4.13.2)
Collecting nvidia-nvjitlink-cu12==12.8.93
  Downloading nvidia_nvjitlink_cu12-12.8.93-py3-none-manylinux2010_x86_64.manylinux_2_12_x86_64.whl (39.3 MB)
     ━━━━━━━━━━━━━━━━━━━━━━━━━━━━━━━━━━━━━━━━ 39.3/39.3 MB 46.3 MB/s eta 0:00:00
Collecting nvidia-cufft-cu12==11.3.3.83
  Downloading nvidia_cufft_cu12-11.3.3.83-py3-none-manylinux2014_x86_64.manylinux_2_17_x86_64.whl (193.1 MB)
     ━━━━━━━━━━━━━━━━━━━━━━━━━━━━━━━━━━━━━━ 193.1/193.1 MB 15.8 MB/s eta 0:00:00
Collecting nvidia-nvshmem-cu12==3.3.20
  Downloading nvidia_nvshmem_cu12-3.3.20-py3-none-manylinux2014_x86_64.manylinux_2_17_x86_64.whl (124.7 MB)
     ━━━━━━━━━━━━━━━━━━━━━━━━━━━━━━━━━━━━━━ 124.7/124.7 MB 20.5 MB/s eta 0:00:00
Collecting nvidia-cusparselt-cu12==0.7.1
  Downloading nvidia_cusparselt_cu12-0.7.1-py3-none-manylinux2014_x86_64.whl (287.2 MB)
     ━━━━━━━━━━━━━━━━━━━━━━━━━━━━━━━━━━━━━━ 287.2/287.2 MB 10.5 MB/s eta 0:00:00
Collecting mpmath<1.4,>=1.1.0
  Downloading mpmath-1.3.0-py3-none-any.whl (536 kB)
     ━━━━━━━━━━━━━━━━━━━━━━━━━━━━━━━━━━━━━ 536.2/536.2 KB 109.1 MB/s eta 0:00:00
Requirement already satisfied: MarkupSafe>=2.0 in /usr/local/lib/python3.10/dist-packages (from jinja2->torch) (3.0.2)
Installing collected packages: nvidia-cusparselt-cu12, mpmath, triton, sympy, nvidia-nvtx-cu12, nvidia-nvshmem-cu12, nvidia-nvjitlink-cu12, nvidia-nccl-cu12, nvidia-curand-cu12, nvidia-cufile-cu12, nvidia-cuda-runtime-cu12, nvidia-cuda-nvrtc-cu12, nvidia-cuda-cupti-cu12, nvidia-cublas-cu12, networkx, fsspec, filelock, nvidia-cusparse-cu12, nvidia-cufft-cu12, nvidia-cudnn-cu12, nvidia-cusolver-cu12, torch
  [0;36m⏱[0m  Monitoring logs: [1;33m 50s[0m / 900s | Log lines: [1;33m145[0m      [0;36m⏱[0m  Monitoring logs: [1;33m 51s[0m / 900s | Log lines: [1;33m145[0m      [0;36m⏱[0m  Monitoring logs: [1;33m 52s[0m / 900s | Log lines: [1;33m145[0m      [0;36m⏱[0m  Monitoring logs: [1;33m 53s[0m / 900s | Log lines: [1;33m145[0m      [0;36m⏱[0m  Monitoring logs: [1;33m 54s[0m / 900s | Log lines: [1;33m145[0m      [0;36m⏱[0m  Monitoring logs: [1;33m 55s[0m / 900s | Log lines: [1;33m145[0m      [0;36m⏱[0m  Monitoring logs: [1;33m 56s[0m / 900s | Log lines: [1;33m145[0m      [0;36m⏱[0m  Monitoring logs: [1;33m 57s[0m / 900s | Log lines: [1;33m145[0m      [0;36m⏱[0m  Monitoring logs: [1;33m 58s[0m / 900s | Log lines: [1;33m145[0m      [0;36m⏱[0m  Monitoring logs: [1;33m 59s[0m / 900s | Log lines: [1;33m145[0m      [0;36m⏱[0m  Monitoring logs: [1;33m 60s[0m / 900s | Log lines: [1;33m142[0m      [0;36m⏱[0m  Monitoring logs: [1;33m 61s[0m / 900s | Log lines: [1;33m142[0m      [0;36m⏱[0m  Monitoring logs: [1;33m 62s[0m / 900s | Log lines: [1;33m142[0m      [0;36m⏱[0m  Monitoring logs: [1;33m 63s[0m / 900s | Log lines: [1;33m142[0m      [0;36m⏱[0m  Monitoring logs: [1;33m 64s[0m / 900s | Log lines: [1;33m142[0m      [0;36m⏱[0m  Monitoring logs: [1;33m 65s[0m / 900s | Log lines: [1;33m142[0m      [0;36m⏱[0m  Monitoring logs: [1;33m 66s[0m / 900s | Log lines: [1;33m142[0m      [0;36m⏱[0m  Monitoring logs: [1;33m 67s[0m / 900s | Log lines: [1;33m142[0m      [0;36m⏱[0m  Monitoring logs: [1;33m 68s[0m / 900s | Log lines: [1;33m142[0m      [0;36m⏱[0m  Monitoring logs: [1;33m 69s[0m / 900s | Log lines: [1;33m142[0m      [0;36m⏱[0m  Monitoring logs: [1;33m 70s[0m / 900s | Log lines: [1;33m142[0m      [0;36m⏱[0m  Monitoring logs: [1;33m 71s[0m / 900s | Log lines: [1;33m142[0m      [0;36m⏱[0m  Monitoring logs: [1;33m 72s[0m / 900s | Log lines: [1;33m142[0m      [0;36m⏱[0m  Monitoring logs: [1;33m 73s[0m / 900s | Log lines: [1;33m142[0m      [0;36m⏱[0m  Monitoring logs: [1;33m 74s[0m / 900s | Log lines: [1;33m142[0m      [0;36m⏱[0m  Monitoring logs: [1;33m 75s[0m / 900s | Log lines: [1;33m142[0m      [0;36m⏱[0m  Monitoring logs: [1;33m 76s[0m / 900s | Log lines: [1;33m142[0m      [0;36m⏱[0m  Monitoring logs: [1;33m 77s[0m / 900s | Log lines: [1;33m142[0m      [0;36m⏱[0m  Monitoring logs: [1;33m 78s[0m / 900s | Log lines: [1;33m142[0m      [0;36m⏱[0m  Monitoring logs: [1;33m 79s[0m / 900s | Log lines: [1;33m142[0m      [0;36m⏱[0m  Monitoring logs: [1;33m 80s[0m / 900s | Log lines: [1;33m142[0m      [0;36m⏱[0m  Monitoring logs: [1;33m 81s[0m / 900s | Log lines: [1;33m142[0m      [0;36m⏱[0m  Monitoring logs: [1;33m 82s[0m / 900s | Log lines: [1;33m142[0m      [0;36m⏱[0m  Monitoring logs: [1;33m 83s[0m / 900s | Log lines: [1;33m142[0m      [0;36m⏱[0m  Monitoring logs: [1;33m 84s[0m / 900s | Log lines: [1;33m142[0m      [0;36m⏱[0m  Monitoring logs: [1;33m 85s[0m / 900s | Log lines: [1;33m142[0m      [0;36m⏱[0m  Monitoring logs: [1;33m 86s[0m / 900s | Log lines: [1;33m142[0m      [0;36m⏱[0m  Monitoring logs: [1;33m 87s[0m / 900s | Log lines: [1;33m142[0m      [0;36m⏱[0m  Monitoring logs: [1;33m 88s[0m / 900s | Log lines: [1;33m142[0m      [0;36m⏱[0m  Monitoring logs: [1;33m 89s[0m / 900s | Log lines: [1;33m142[0m      [0;36m⏱[0m  Monitoring logs: [1;33m 90s[0m / 900s | Log lines: [1;33m143[0m      [0;36m⏱[0m  Monitoring logs: [1;33m 91s[0m / 900s | Log lines: [1;33m143[0m      [0;36m⏱[0m  Monitoring logs: [1;33m 92s[0m / 900s | Log lines: [1;33m143[0m      [0;36m⏱[0m  Monitoring logs: [1;33m 93s[0m / 900s | Log lines: [1;33m143[0m      [0;36m⏱[0m  Monitoring logs: [1;33m 94s[0m / 900s | Log lines: [1;33m143[0m      [0;36m⏱[0m  Monitoring logs: [1;33m 95s[0m / 900s | Log lines: [1;33m143[0m      [0;36m⏱[0m  Monitoring logs: [1;33m 96s[0m / 900s | Log lines: [1;33m143[0m      [0;36m⏱[0m  Monitoring logs: [1;33m 97s[0m / 900s | Log lines: [1;33m143[0m      [0;36m⏱[0m  Monitoring logs: [1;33m 98s[0m / 900s | Log lines: [1;33m143[0m      [0;36m⏱[0m  Monitoring logs: [1;33m 99s[0m / 900s | Log lines: [1;33m143[0m    
+ cd /workspace
+ wget -q -O ./agent https://downloads.silicondata.com/agent
+ chmod +x ./agent
+ echo '=== Setup Complete, Running Benchmark ==='
=== Setup Complete, Running Benchmark ===
+ ./agent -api-key eyJhbGciOiJIUzI1NiIsImtpZCI6IlNpbGljb25fe2NvZGV9IiwidHlwIjoiand0X2FwcF90b2tlbiJ9.eyJqb2JfaWQiOjE5OTU5ODE4NzIwNjAwNDczNjAsImVtYWlsIjoidG9qYWlndXB0YUBnbWFpbC5jb20iLCJleHAiOjE3NjQ4MDA1MzZ9.IsNSNrgi6X5MzWU8AkByWww8qyCmO9tefDlx98a9CQ4
Trace ID: 3b62f128a84553a5af379f4c448b7a40
{"time":"2025-12-02T22:24:53.421986816Z","level":"INFO","msg":"Python executable verified: python3"}
{"time":"2025-12-02T22:24:57.878028456Z","level":"INFO","msg":"Packages verified: torch 2.9.1,pynvml 13.0.1,numpy 2.2.5"}
{"time":"2025-12-02T22:25:00.496635274Z","level":"INFO","msg":"Environment validated"}
{"time":"2025-12-02T22:25:00.704387051Z","level":"INFO","msg":"Benchmark quick_mark validated successfully"}
  [0;36m⏱[0m  Monitoring logs: [1;33m100s[0m / 900s | Log lines: [1;33m156[0m      [0;36m⏱[0m  Monitoring logs: [1;33m101s[0m / 900s | Log lines: [1;33m156[0m      [0;36m⏱[0m  Monitoring logs: [1;33m102s[0m / 900s | Log lines: [1;33m156[0m      [0;36m⏱[0m  Monitoring logs: [1;33m103s[0m / 900s | Log lines: [1;33m156[0m      [0;36m⏱[0m  Monitoring logs: [1;33m104s[0m / 900s | Log lines: [1;33m156[0m      [0;36m⏱[0m  Monitoring logs: [1;33m105s[0m / 900s | Log lines: [1;33m156[0m      [0;36m⏱[0m  Monitoring logs: [1;33m106s[0m / 900s | Log lines: [1;33m156[0m      [0;36m⏱[0m  Monitoring logs: [1;33m107s[0m / 900s | Log lines: [1;33m156[0m      [0;36m⏱[0m  Monitoring logs: [1;33m108s[0m / 900s | Log lines: [1;33m156[0m      [0;36m⏱[0m  Monitoring logs: [1;33m109s[0m / 900s | Log lines: [1;33m156[0m    
{"time":"2025-12-02T22:25:01.068774073Z","level":"INFO","msg":"QuickMark: Running system inventory"}
{"time":"2025-12-02T22:25:02.283234237Z","level":"INFO","msg":"Successfully parsed 1 GPU infos"}
{"time":"2025-12-02T22:25:04.963196659Z","level":"INFO","msg":"Collected location info: US"}
  [0;36m⏱[0m  Monitoring logs: [1;33m110s[0m / 900s | Log lines: [1;33m159[0m      [0;36m⏱[0m  Monitoring logs: [1;33m111s[0m / 900s | Log lines: [1;33m159[0m      [0;36m⏱[0m  Monitoring logs: [1;33m112s[0m / 900s | Log lines: [1;33m159[0m      [0;36m⏱[0m  Monitoring logs: [1;33m113s[0m / 900s | Log lines: [1;33m159[0m      [0;36m⏱[0m  Monitoring logs: [1;33m114s[0m / 900s | Log lines: [1;33m159[0m      [0;36m⏱[0m  Monitoring logs: [1;33m115s[0m / 900s | Log lines: [1;33m159[0m      [0;36m⏱[0m  Monitoring logs: [1;33m116s[0m / 900s | Log lines: [1;33m159[0m      [0;36m⏱[0m  Monitoring logs: [1;33m117s[0m / 900s | Log lines: [1;33m159[0m      [0;36m⏱[0m  Monitoring logs: [1;33m118s[0m / 900s | Log lines: [1;33m159[0m      [0;36m⏱[0m  Monitoring logs: [1;33m119s[0m / 900s | Log lines: [1;33m159[0m    
     ━━━━━━━━━━━━━━━━━━━━━━━━━━━━━━━━━━━━━━ 124.7/124.7 MB 20.5 MB/s eta 0:00:00
Collecting nvidia-cusparselt-cu12==0.7.1
  Downloading nvidia_cusparselt_cu12-0.7.1-py3-none-manylinux2014_x86_64.whl (287.2 MB)
     ━━━━━━━━━━━━━━━━━━━━━━━━━━━━━━━━━━━━━━ 287.2/287.2 MB 10.5 MB/s eta 0:00:00
Collecting mpmath<1.4,>=1.1.0
  Downloading mpmath-1.3.0-py3-none-any.whl (536 kB)
     ━━━━━━━━━━━━━━━━━━━━━━━━━━━━━━━━━━━━━ 536.2/536.2 KB 109.1 MB/s eta 0:00:00
Requirement already satisfied: MarkupSafe>=2.0 in /usr/local/lib/python3.10/dist-packages (from jinja2->torch) (3.0.2)
Installing collected packages: nvidia-cusparselt-cu12, mpmath, triton, sympy, nvidia-nvtx-cu12, nvidia-nvshmem-cu12, nvidia-nvjitlink-cu12, nvidia-nccl-cu12, nvidia-curand-cu12, nvidia-cufile-cu12, nvidia-cuda-runtime-cu12, nvidia-cuda-nvrtc-cu12, nvidia-cuda-cupti-cu12, nvidia-cublas-cu12, networkx, fsspec, filelock, nvidia-cusparse-cu12, nvidia-cufft-cu12, nvidia-cudnn-cu12, nvidia-cusolver-cu12, torch
Successfully installed filelock-3.20.0 fsspec-2025.10.0 mpmath-1.3.0 networkx-3.4.2 nvidia-cublas-cu12-12.8.4.1 nvidia-cuda-cupti-cu12-12.8.90 nvidia-cuda-nvrtc-cu12-12.8.93 nvidia-cuda-runtime-cu12-12.8.90 nvidia-cudnn-cu12-9.10.2.21 nvidia-cufft-cu12-11.3.3.83 nvidia-cufile-cu12-1.13.1.3 nvidia-curand-cu12-10.3.9.90 nvidia-cusolver-cu12-11.7.3.90 nvidia-cusparse-cu12-12.5.8.93 nvidia-cusparselt-cu12-0.7.1 nvidia-nccl-cu12-2.27.5 nvidia-nvjitlink-cu12-12.8.93 nvidia-nvshmem-cu12-3.3.20 nvidia-n
WARNING: Running pip as the 'root' user can result in broken permissions and conflicting behaviour with the system package manager. It is recommended to use a virtual environment instead: https://pip.pypa.io/warnings/venv
+ cd /workspace
+ wget -q -O ./agent https://downloads.silicondata.com/agent
+ chmod +x ./agent
+ echo '=== Setup Complete, Running Benchmark ==='
=== Setup Complete, Running Benchmark ===
+ ./agent -api-key eyJhbGciOiJIUzI1NiIsImtpZCI6IlNpbGljb25fe2NvZGV9IiwidHlwIjoiand0X2FwcF90b2tlbiJ9.eyJqb2JfaWQiOjE5OTU5ODE4NzIwNjAwNDczNjAsImVtYWlsIjoidG9qYWlndXB0YUBnbWFpbC5jb20iLCJleHAiOjE3NjQ4MDA1MzZ9.IsNSNrgi6X5MzWU8AkByWww8qyCmO9tefDlx98a9CQ4
Trace ID: 3b62f128a84553a5af379f4c448b7a40
{"time":"2025-12-02T22:24:53.421986816Z","level":"INFO","msg":"Python executable verified: python3"}
{"time":"2025-12-02T22:24:57.878028456Z","level":"INFO","msg":"Packages verified: torch 2.9.1,pynvml 13.0.1,numpy 2.2.5"}
{"time":"2025-12-02T22:25:00.496635274Z","level":"INFO","msg":"Environment validated"}
{"time":"2025-12-02T22:25:00.704387051Z","level":"INFO","msg":"Benchmark quick_mark validated successfully"}
{"time":"2025-12-02T22:25:01.068774073Z","level":"INFO","msg":"QuickMark: Running system inventory"}
{"time":"2025-12-02T22:25:02.283234237Z","level":"INFO","msg":"Successfully parsed 1 GPU infos"}
{"time":"2025-12-02T22:25:04.963196659Z","level":"INFO","msg":"Collected location info: US"}
  [0;36m⏱[0m  Monitoring logs: [1;33m120s[0m / 900s | Log lines: [1;33m184[0m      [0;36m⏱[0m  Monitoring logs: [1;33m121s[0m / 900s | Log lines: [1;33m184[0m      [0;36m⏱[0m  Monitoring logs: [1;33m122s[0m / 900s | Log lines: [1;33m184[0m      [0;36m⏱[0m  Monitoring logs: [1;33m123s[0m / 900s | Log lines: [1;33m184[0m      [0;36m⏱[0m  Monitoring logs: [1;33m124s[0m / 900s | Log lines: [1;33m184[0m      [0;36m⏱[0m  Monitoring logs: [1;33m125s[0m / 900s | Log lines: [1;33m184[0m      [0;36m⏱[0m  Monitoring logs: [1;33m126s[0m / 900s | Log lines: [1;33m184[0m      [0;36m⏱[0m  Monitoring logs: [1;33m127s[0m / 900s | Log lines: [1;33m184[0m      [0;36m⏱[0m  Monitoring logs: [1;33m128s[0m / 900s | Log lines: [1;33m184[0m      [0;36m⏱[0m  Monitoring logs: [1;33m129s[0m / 900s | Log lines: [1;33m184[0m      [0;36m⏱[0m  Monitoring logs: [1;33m130s[0m / 900s | Log lines: [1;33m165[0m      [0;36m⏱[0m  Monitoring logs: [1;33m131s[0m / 900s | Log lines: [1;33m165[0m      [0;36m⏱[0m  Monitoring logs: [1;33m132s[0m / 900s | Log lines: [1;33m165[0m      [0;36m⏱[0m  Monitoring logs: [1;33m133s[0m / 900s | Log lines: [1;33m165[0m      [0;36m⏱[0m  Monitoring logs: [1;33m134s[0m / 900s | Log lines: [1;33m165[0m      [0;36m⏱[0m  Monitoring logs: [1;33m135s[0m / 900s | Log lines: [1;33m165[0m      [0;36m⏱[0m  Monitoring logs: [1;33m136s[0m / 900s | Log lines: [1;33m165[0m      [0;36m⏱[0m  Monitoring logs: [1;33m137s[0m / 900s | Log lines: [1;33m165[0m      [0;36m⏱[0m  Monitoring logs: [1;33m138s[0m / 900s | Log lines: [1;33m165[0m      [0;36m⏱[0m  Monitoring logs: [1;33m139s[0m / 900s | Log lines: [1;33m165[0m      [0;36m⏱[0m  Monitoring logs: [1;33m140s[0m / 900s | Log lines: [1;33m165[0m      [0;36m⏱[0m  Monitoring logs: [1;33m141s[0m / 900s | Log lines: [1;33m165[0m      [0;36m⏱[0m  Monitoring logs: [1;33m142s[0m / 900s | Log lines: [1;33m165[0m      [0;36m⏱[0m  Monitoring logs: [1;33m143s[0m / 900s | Log lines: [1;33m165[0m      [0;36m⏱[0m  Monitoring logs: [1;33m144s[0m / 900s | Log lines: [1;33m165[0m      [0;36m⏱[0m  Monitoring logs: [1;33m145s[0m / 900s | Log lines: [1;33m165[0m      [0;36m⏱[0m  Monitoring logs: [1;33m146s[0m / 900s | Log lines: [1;33m165[0m      [0;36m⏱[0m  Monitoring logs: [1;33m147s[0m / 900s | Log lines: [1;33m165[0m      [0;36m⏱[0m  Monitoring logs: [1;33m148s[0m / 900s | Log lines: [1;33m165[0m      [0;36m⏱[0m  Monitoring logs: [1;33m149s[0m / 900s | Log lines: [1;33m165[0m      [0;36m⏱[0m  Monitoring logs: [1;33m150s[0m / 900s | Log lines: [1;33m165[0m      [0;36m⏱[0m  Monitoring logs: [1;33m151s[0m / 900s | Log lines: [1;33m165[0m      [0;36m⏱[0m  Monitoring logs: [1;33m152s[0m / 900s | Log lines: [1;33m165[0m      [0;36m⏱[0m  Monitoring logs: [1;33m153s[0m / 900s | Log lines: [1;33m165[0m      [0;36m⏱[0m  Monitoring logs: [1;33m154s[0m / 900s | Log lines: [1;33m165[0m      [0;36m⏱[0m  Monitoring logs: [1;33m155s[0m / 900s | Log lines: [1;33m165[0m      [0;36m⏱[0m  Monitoring logs: [1;33m156s[0m / 900s | Log lines: [1;33m165[0m      [0;36m⏱[0m  Monitoring logs: [1;33m157s[0m / 900s | Log lines: [1;33m165[0m      [0;36m⏱[0m  Monitoring logs: [1;33m158s[0m / 900s | Log lines: [1;33m165[0m      [0;36m⏱[0m  Monitoring logs: [1;33m159s[0m / 900s | Log lines: [1;33m165[0m      [0;36m⏱[0m  Monitoring logs: [1;33m160s[0m / 900s | Log lines: [1;33m165[0m      [0;36m⏱[0m  Monitoring logs: [1;33m161s[0m / 900s | Log lines: [1;33m165[0m      [0;36m⏱[0m  Monitoring logs: [1;33m162s[0m / 900s | Log lines: [1;33m165[0m      [0;36m⏱[0m  Monitoring logs: [1;33m163s[0m / 900s | Log lines: [1;33m165[0m      [0;36m⏱[0m  Monitoring logs: [1;33m164s[0m / 900s | Log lines: [1;33m165[0m      [0;36m⏱[0m  Monitoring logs: [1;33m165s[0m / 900s | Log lines: [1;33m165[0m      [0;36m⏱[0m  Monitoring logs: [1;33m166s[0m / 900s | Log lines: [1;33m165[0m      [0;36m⏱[0m  Monitoring logs: [1;33m167s[0m / 900s | Log lines: [1;33m165[0m      [0;36m⏱[0m  Monitoring logs: [1;33m168s[0m / 900s | Log lines: [1;33m165[0m      [0;36m⏱[0m  Monitoring logs: [1;33m169s[0m / 900s | Log lines: [1;33m165[0m      [0;36m⏱[0m  Monitoring logs: [1;33m170s[0m / 900s | Log lines: [1;33m170[0m      [0;36m⏱[0m  Monitoring logs: [1;33m171s[0m / 900s | Log lines: [1;33m170[0m      [0;36m⏱[0m  Monitoring logs: [1;33m172s[0m / 900s | Log lines: [1;33m170[0m      [0;36m⏱[0m  Monitoring logs: [1;33m173s[0m / 900s | Log lines: [1;33m170[0m      [0;36m⏱[0m  Monitoring logs: [1;33m174s[0m / 900s | Log lines: [1;33m170[0m      [0;36m⏱[0m  Monitoring logs: [1;33m175s[0m / 900s | Log lines: [1;33m170[0m      [0;36m⏱[0m  Monitoring logs: [1;33m176s[0m / 900s | Log lines: [1;33m170[0m      [0;36m⏱[0m  Monitoring logs: [1;33m177s[0m / 900s | Log lines: [1;33m170[0m      [0;36m⏱[0m  Monitoring logs: [1;33m178s[0m / 900s | Log lines: [1;33m170[0m      [0;36m⏱[0m  Monitoring logs: [1;33m179s[0m / 900s | Log lines: [1;33m170[0m    
          "fp32_tflops": 124.33,
          "gpu_id": "GPU-3aea7896-6f08-af19-5e8e-4257940033f9",
          "host_to_device_bandwidth_gbs": 20.74,
          "kernel_launch_overhead_us": 7.89,
          "l2_bandwidth_gbs": 282.87,
          "memory_bandwidth_gbs": 1380.93,
          "mixed_precision_tflops": 248.04,
          "power_consumption_watts": 497.55,
          "temperature_centigrade": 71
        },
        "test_results": [
          {
            "bf16_tflops": 266.93,
            "device_to_host_bandwidth_gbs": 20.78,
            "fp16_tflops": 260.91,
            "fp32_cuda_core_tflops": 19.09,
            "fp32_tflops": 124.33,
            "gpu_id": "GPU-3aea7896-6f08-af19-5e8e-4257940033f9",
            "host_to_device_bandwidth_gbs": 20.74,
            "kernel_launch_overhead_us": 7.89,
            "l2_bandwidth_gbs": 282.87,
            "memory_bandwidth_gbs": 1380.93,
            "mixed_precision_tflops": 248.04,
            "power_consumption_watts": 497.55,
            "temperature_centigrade": 71
          }
        ],
        "timestamp": "2025-12-02T22:26:21.761072178Z"
      },
      "started_at": "2025-12-02T22:25:35.394288Z",
      "state": "completed"
    }
  },
  "company_name": "OTCR",
  "configuration_id": "9f549d3b-6449-5402-9ba1-3c9a1dd2725a",
  "created_at": "2025-12-02T22:25:00.877404Z",
  "ended_at": "2025-12-02T22:26:21.933880Z",
  "failed_message": null,
  "gpu_count": 1,
  "gpu_model": "NVIDIA A100-SXM4-40GB",
  "id": "1995982561481990144",
  "inventory": {
    "config_id": "9f549d3b-6449-5402-9ba1-3c9a1dd2725a",
    "cpu": {
      "arch": "x86_64",
      "count": 128,
      "os": "ubuntu 22.04",
      "processor": "AMD EPYC 7713 64-Core Processor",
      "virtualization_type": "guest"
    },
    "disk": {
      "model": "PERC H745 Adp",
      "size_gb": 2253,
      "technology": "SSD"
    },
    "gpu": {
      "count": 1,
      "cuda_version": "12.8",
      "driver_version": "570.133.07",
      "memory_gb": 39,
      "model": "NVIDIA A100-SXM4-40GB",
      "network_type": null,
      "vendor": "NVIDIA"
    },
    "location": "US",
    "machine_id": "ffc3da25-8526-5c36-a841-a22dc15dcca0",
    "memory": {
      "total_gb": 503,
      "type": "Unknown"
    },
    "network": {
      "download_speed_mbps": 915,
      "machine_ip": "172.17.0.4",
      "open_ports": 2,
      "upload_speed_mbps": 885
    }
  },
  "job_id": "1995981872060047360",
  "machine_ip": null,
  "machine_uuid": "ffc3da25-8526-5c36-a841-a22dc15dcca0",
  "manufacturer_gpu_spec": {
    "bandwidth": "1560.0",
    "fp16": "77.97",
    "fp32": "19.49"
  },
  "pdf_report_url": "s3://sd-siliconmark-output/O006/1995981872060047360/pdf_reports/1995982561481990144.pdf",
  "started_at": "2025-12-02T22:25:00.873811Z",
  "state": "completed"
}
+ echo '=== QUICKMARK_BENCHMARK_COMPLETE ==='
=== QUICKMARK_BENCHMARK_COMPLETE ===

[0;32m[SUCCESS][0m Benchmark complete detected in logs!

[0;32m[SUCCESS][0m Benchmark completed!

[0;36m════════════════════════════════════════[0m
[0;36m  Step 6: Parsing and Saving Results[0m
[0;36m════════════════════════════════════════[0m
[0;34m[INFO][0m Raw result saved to siliconmark_output.json
[0;32m[SUCCESS][0m Benchmark Results:
  [0;36mGPU:[0m               NVIDIA A100-SXM4-40GB (x1)
  [0;36mBF16 TFLOPS:[0m       266.93
  [0;36mFP16 TFLOPS:[0m       260.91
  [0;36mFP32 TFLOPS:[0m       124.33
  [0;36mMixed Precision:[0m   248.04 TFLOPS
  [0;36mMemory BW:[0m         1380.93 GB/s
  [0;36mPower:[0m             497.55 W
  [0;36mTemperature:[0m       71 °C
[0;32m[SUCCESS][0m Results appended to /Users/jai/Documents/GitHub/vastai/quickmark_results.json

[0;36m════════════════════════════════════════[0m
[0;36m  Step 7: Destroying Instance[0m
[0;36m════════════════════════════════════════[0m
[0;34m[INFO][0m Destroying instance 28442936...
null
[0;32m[SUCCESS][0m Instance destroyed

[0;36m════════════════════════════════════════[0m
[0;36m  Benchmark Complete![0m
[0;36m════════════════════════════════════════[0m
[0;32mSummary:[0m
  Machine ID:      39209
  GPU:             NVIDIA A100-SXM4-40GB
  QuickMark Score: [0;32m266.93[0m BF16 TFLOPS
  DLPerf:          94.29573119937139
  Results saved:   /Users/jai/Documents/GitHub/vastai/quickmark_results.json

[0;36mTip:[0m Refresh your dashboard to see the new data point!
