
[0;36m════════════════════════════════════════[0m
[0;36m  Step 0: Validating Prerequisites[0m
[0;36m════════════════════════════════════════[0m
[0;32m[SUCCESS][0m All required tools found
[0;32m[SUCCESS][0m SiliconData credentials configured
[0;32m[SUCCESS][0m Vast.ai API key configured

[0;36m════════════════════════════════════════[0m
[0;36m  Step 1: Get Machine ID[0m
[0;36m════════════════════════════════════════[0m
[0;34m[INFO][0m Using machine ID from argument: 34282
[0;32m[SUCCESS][0m Target machine ID: 34282

[0;36m════════════════════════════════════════[0m
[0;36m  Step 2: Finding Offer for Machine 34282[0m
[0;36m════════════════════════════════════════[0m
[0;34m[INFO][0m Searching for available offers on machine 34282...
[0;32m[SUCCESS][0m Found offer:
  [0;36mOffer ID:[0m     28439750
  [0;36mGPU:[0m          1 x A100 SXM4
  [0;36mDLPerf:[0m       95.44098961204517
  [0;36mPrice:[0m        $0.584364602962963/hr
  [0;36mLocation:[0m     The Netherlands, NL
  [0;36mHost ID:[0m      37070
[0;34m[INFO][0m Proceeding automatically to rent this instance...

[0;36m════════════════════════════════════════[0m
[0;36m  Step 3: Creating SiliconMark Job[0m
[0;36m════════════════════════════════════════[0m
[0;34m[INFO][0m Job name: quickmark-machine-34282-20251202-162211
[0;34m[INFO][0m Logging into SiliconData as tojaigupta@gmail.com...
[0;32m[SUCCESS][0m Got SiliconData auth token
[0;34m[INFO][0m Creating SiliconMark job...
[0;32m[SUCCESS][0m SiliconMark job created
  [0;36mJob ID:[0m    1995981872479477760
  [0;36mAPI Key:[0m   eyJhbGciOiJIUzI1NiIsImtpZCI6IlNpbGljb25f...

[0;36m════════════════════════════════════════[0m
[0;36m  Step 4: Creating Vast.ai Instance[0m
[0;36m════════════════════════════════════════[0m
[0;34m[INFO][0m Creating instance from offer 28439750...
[0;34m[INFO][0m Using image: vastai/pytorch
{
 "new_contract": 28442939,
 "success": true
}
[0;32m[SUCCESS][0m Instance created: 28442939

[0;36m════════════════════════════════════════[0m
[0;36m  Step 5: Waiting for Instance to be Ready[0m
[0;36m════════════════════════════════════════[0m

[0;34m[INFO][0m Status changed to: unknown
  [0;36m⏱[0m  Waiting: [1;33m  0s[0m / 300s | Status: [1;33munknown[0m      [0;36m⏱[0m  Waiting: [1;33m  1s[0m / 300s | Status: [1;33munknown[0m      [0;36m⏱[0m  Waiting: [1;33m  2s[0m / 300s | Status: [1;33munknown[0m      [0;36m⏱[0m  Waiting: [1;33m  3s[0m / 300s | Status: [1;33munknown[0m      [0;36m⏱[0m  Waiting: [1;33m  4s[0m / 300s | Status: [1;33munknown[0m      [0;36m⏱[0m  Waiting: [1;33m  5s[0m / 300s | Status: [1;33munknown[0m      [0;36m⏱[0m  Waiting: [1;33m  6s[0m / 300s | Status: [1;33munknown[0m      [0;36m⏱[0m  Waiting: [1;33m  7s[0m / 300s | Status: [1;33munknown[0m      [0;36m⏱[0m  Waiting: [1;33m  8s[0m / 300s | Status: [1;33munknown[0m      [0;36m⏱[0m  Waiting: [1;33m  9s[0m / 300s | Status: [1;33munknown[0m      [0;36m⏱[0m  Waiting: [1;33m 10s[0m / 300s | Status: [1;33munknown[0m      [0;36m⏱[0m  Waiting: [1;33m 11s[0m / 300s | Status: [1;33munknown[0m      [0;36m⏱[0m  Waiting: [1;33m 12s[0m / 300s | Status: [1;33munknown[0m      [0;36m⏱[0m  Waiting: [1;33m 13s[0m / 300s | Status: [1;33munknown[0m      [0;36m⏱[0m  Waiting: [1;33m 14s[0m / 300s | Status: [1;33munknown[0m      [0;36m⏱[0m  Waiting: [1;33m 15s[0m / 300s | Status: [1;33munknown[0m      [0;36m⏱[0m  Waiting: [1;33m 16s[0m / 300s | Status: [1;33munknown[0m      [0;36m⏱[0m  Waiting: [1;33m 17s[0m / 300s | Status: [1;33munknown[0m      [0;36m⏱[0m  Waiting: [1;33m 18s[0m / 300s | Status: [1;33munknown[0m      [0;36m⏱[0m  Waiting: [1;33m 19s[0m / 300s | Status: [1;33munknown[0m      [0;36m⏱[0m  Waiting: [1;33m 20s[0m / 300s | Status: [1;33munknown[0m      [0;36m⏱[0m  Waiting: [1;33m 21s[0m / 300s | Status: [1;33munknown[0m      [0;36m⏱[0m  Waiting: [1;33m 22s[0m / 300s | Status: [1;33munknown[0m      [0;36m⏱[0m  Waiting: [1;33m 23s[0m / 300s | Status: [1;33munknown[0m      [0;36m⏱[0m  Waiting: [1;33m 24s[0m / 300s | Status: [1;33munknown[0m      [0;36m⏱[0m  Waiting: [1;33m 25s[0m / 300s | Status: [1;33munknown[0m      [0;36m⏱[0m  Waiting: [1;33m 26s[0m / 300s | Status: [1;33munknown[0m      [0;36m⏱[0m  Waiting: [1;33m 27s[0m / 300s | Status: [1;33munknown[0m      [0;36m⏱[0m  Waiting: [1;33m 28s[0m / 300s | Status: [1;33munknown[0m      [0;36m⏱[0m  Waiting: [1;33m 29s[0m / 300s | Status: [1;33munknown[0m    
[0;34m[INFO][0m Status changed to: loading
  [0;36m⏱[0m  Waiting: [1;33m 30s[0m / 300s | Status: [1;33mloading[0m      [0;36m⏱[0m  Waiting: [1;33m 31s[0m / 300s | Status: [1;33mloading[0m      [0;36m⏱[0m  Waiting: [1;33m 32s[0m / 300s | Status: [1;33mloading[0m      [0;36m⏱[0m  Waiting: [1;33m 33s[0m / 300s | Status: [1;33mloading[0m      [0;36m⏱[0m  Waiting: [1;33m 34s[0m / 300s | Status: [1;33mloading[0m      [0;36m⏱[0m  Waiting: [1;33m 35s[0m / 300s | Status: [1;33mloading[0m      [0;36m⏱[0m  Waiting: [1;33m 36s[0m / 300s | Status: [1;33mloading[0m      [0;36m⏱[0m  Waiting: [1;33m 37s[0m / 300s | Status: [1;33mloading[0m      [0;36m⏱[0m  Waiting: [1;33m 38s[0m / 300s | Status: [1;33mloading[0m      [0;36m⏱[0m  Waiting: [1;33m 39s[0m / 300s | Status: [1;33mloading[0m    
[0;34m[INFO][0m Status changed to: running

[0;32m[SUCCESS][0m Instance is running!

[0;34m[INFO][0m Waiting for benchmark to complete (running in startup script)...
[0;34m[INFO][0m Monitoring logs for 'QUICKMARK_BENCHMARK_COMPLETE' message...
[0;34m[INFO][0m This typically takes 5-10 minutes...

waiting on logs for instance 28442939 fetching from https://s3.amazonaws.com/public.vast.ai/instance_logs/a50bca19834e4e2d4420fd1787754dfd.log
waiting on logs for instance 28442939 fetching from https://s3.amazonaws.com/public.vast.ai/instance_logs/a50bca19834e4e2d4420fd1787754dfd.log
Tue Dec  2 22:22:47 UTC 2025
Hit:1 http://archive.ubuntu.com/ubuntu jammy InRelease
Get:2 http://archive.ubuntu.com/ubuntu jammy-updates InRelease [128 kB]
Get:3 http://security.ubuntu.com/ubuntu jammy-security InRelease [129 kB]
Get:4 http://archive.ubuntu.com/ubuntu jammy-backports InRelease [127 kB]
Get:5 https://developer.download.nvidia.com/compute/cuda/repos/ubuntu2204/x86_64  InRelease [1581 B]
Get:6 https://ppa.launchpadcontent.net/deadsnakes/nightly/ubuntu jammy InRelease [18.1 kB]
Hit:7 https://ppa.launchpadcontent.net/deadsnakes/ppa/ubuntu jammy InRelease
Get:8 http://archive.ubuntu.com/ubuntu jammy-updates/main i386 Packages [1138 kB]
Get:9 http://archive.ubuntu.com/ubuntu jammy-updates/main amd64 Packages [3870 kB]
Get:10 http://archive.ubuntu.com/ubuntu jammy-updates/universe i386 Packages [986 kB]
Get:11 http://archive.ubuntu.com/ubuntu jammy-updates/universe amd64 Packages [1597 kB]
Get:12 https://developer.download.nvidia.com/compute/cuda/repos/ubuntu2204/x86_64  Packages [2159 kB]
Get:13 https://ppa.launchpadcontent.net/deadsnakes/nightly/ubuntu jammy/main amd64 Packages [25.5 kB]
Get:14 https://ppa.launchpadcontent.net/deadsnakes/nightly/ubuntu jammy/main i386 Packages [2867 B]
Get:15 http://security.ubuntu.com/ubuntu jammy-security/main i386 Packages [904 kB]
Get:16 http://security.ubuntu.com/ubuntu jammy-security/universe i386 Packages [844 kB]
Get:17 http://security.ubuntu.com/ubuntu jammy-security/universe amd64 Packages [1286 kB]
Get:18 http://security.ubuntu.com/ubuntu jammy-security/main amd64 Packages [3535 kB]
Fetched 16.8 MB in 2s (10.8 MB/s)
Reading package lists...
Reading package lists...
Building dependency tree...
Reading state information...
curl is already the newest version (7.81.0-1ubuntu1.21).
less is already the newest version (590-1ubuntu0.22.04.3).
locales is already the newest version (2.35-0ubuntu3.11).
openssh-server is already the newest version (1:8.9p1-3ubuntu0.13).
software-properties-common is already the newest version (0.99.22.9).
sudo is already the newest version (1.9.9-1ubuntu2.5).
tmux is already the newest version (3.2a-4ubuntu0.2).
wget is already the newest version (1.21.2-2ubuntu1.1).
0 upgraded, 0 newly installed, 0 to remove and 122 not upgraded.
Reading package lists...
Building dependency tree...
Reading state information...
git is already the newest version (1:2.34.1-1ubuntu1.15).
rsync is already the newest version (3.2.7-0ubuntu0.22.04.4).
0 upgraded, 0 newly installed, 0 to remove and 122 not upgraded.
rm: cannot remove '/etc/forward_port2': No such file or directory
+ echo '=== QuickMark Setup Starting ==='
=== QuickMark Setup Starting ===
+ apt-get update
Server listening on 0.0.0.0 port 22.
Server listening on :: port 22.
Tue Dec  2 22:22:54 UTC 2025
Hit:1 http://archive.ubuntu.com/ubuntu jammy InRelease
Hit:2 http://archive.ubuntu.com/ubuntu jammy-updates InRelease
Hit:3 http://archive.ubuntu.com/ubuntu jammy-backports InRelease
Hit:4 http://security.ubuntu.com/ubuntu jammy-security InRelease
Hit:5 https://ppa.launchpadcontent.net/deadsnakes/nightly/ubuntu jammy InRelease
Hit:6 https://developer.download.nvidia.com/compute/cuda/repos/ubuntu2204/x86_64  InRelease
Hit:7 https://ppa.launchpadcontent.net/deadsnakes/ppa/ubuntu jammy InRelease
Warning: Permanently added 'ssh4.vast.ai' (ED25519) to the list of known hosts.
Reading package lists...
+ apt-get install -y libgpgme11 wget
Reading package lists...
Building dependency tree...
Reading state information...
wget is already the newest version (1.21.2-2ubuntu1.1).
The following NEW packages will be installed:
  libgpgme11
0 upgraded, 1 newly installed, 0 to remove and 122 not upgraded.
Need to get 136 kB of archives.
After this operation, 381 kB of additional disk space will be used.
Get:1 http://archive.ubuntu.com/ubuntu jammy-updates/main amd64 libgpgme11 amd64 1.16.0-1.2ubuntu4.2 [136 kB]
debconf: delaying package configuration, since apt-utils is not installed
Fetched 136 kB in 0s (1414 kB/s)
Selecting previously unselected package libgpgme11:amd64.
(Reading database ... (Reading database ... 5%(Reading database ... 10%(Reading database ... 15%(Reading database ... 20%(Reading database ... 25%(Reading database ... 30%(Reading database ... 35%(Reading database ... 40%(Reading database ... 45%(Reading database ... 50%(Reading database ... 55%(Reading database ... 60%(Reading database ... 65%(Reading database ... 70%(Reading database ... 75%(Reading database ... 80%(Reading database ... 85%(Reading database ... 90%(Reading d
Preparing to unpack .../libgpgme11_1.16.0-1.2ubuntu4.2_amd64.deb ...
Unpacking libgpgme11:amd64 (1.16.0-1.2ubuntu4.2) ...
Setting up libgpgme11:amd64 (1.16.0-1.2ubuntu4.2) ...
Processing triggers for libc-bin (2.35-0ubuntu3.9) ...
+ pip3 install pynvml
Collecting pynvml
  Downloading pynvml-13.0.1-py3-none-any.whl (28 kB)
Collecting nvidia-ml-py>=12.0.0
  Downloading nvidia_ml_py-13.580.82-py3-none-any.whl (49 kB)
     ━━━━━━━━━━━━━━━━━━━━━━━━━━━━━━━━━━━━━━━━ 49.0/49.0 KB 3.3 MB/s eta 0:00:00
Installing collected packages: nvidia-ml-py, pynvml
Successfully installed nvidia-ml-py-13.580.82 pynvml-13.0.1
WARNING: Running pip as the 'root' user can result in broken permissions and conflicting behaviour with the system package manager. It is recommended to use a virtual environment instead: https://pip.pypa.io/warnings/venv
+ pip3 install torch
  [0;36m⏱[0m  Monitoring logs: [1;33m  0s[0m / 900s | Log lines: [1;33m86[0m      [0;36m⏱[0m  Monitoring logs: [1;33m  1s[0m / 900s | Log lines: [1;33m86[0m      [0;36m⏱[0m  Monitoring logs: [1;33m  2s[0m / 900s | Log lines: [1;33m86[0m      [0;36m⏱[0m  Monitoring logs: [1;33m  3s[0m / 900s | Log lines: [1;33m86[0m      [0;36m⏱[0m  Monitoring logs: [1;33m  4s[0m / 900s | Log lines: [1;33m86[0m      [0;36m⏱[0m  Monitoring logs: [1;33m  5s[0m / 900s | Log lines: [1;33m86[0m      [0;36m⏱[0m  Monitoring logs: [1;33m  6s[0m / 900s | Log lines: [1;33m86[0m      [0;36m⏱[0m  Monitoring logs: [1;33m  7s[0m / 900s | Log lines: [1;33m86[0m      [0;36m⏱[0m  Monitoring logs: [1;33m  8s[0m / 900s | Log lines: [1;33m86[0m      [0;36m⏱[0m  Monitoring logs: [1;33m  9s[0m / 900s | Log lines: [1;33m86[0m    
Collecting torch
  Downloading torch-2.9.1-cp310-cp310-manylinux_2_28_x86_64.whl (899.8 MB)
  [0;36m⏱[0m  Monitoring logs: [1;33m 10s[0m / 900s | Log lines: [1;33m88[0m      [0;36m⏱[0m  Monitoring logs: [1;33m 11s[0m / 900s | Log lines: [1;33m88[0m      [0;36m⏱[0m  Monitoring logs: [1;33m 12s[0m / 900s | Log lines: [1;33m88[0m      [0;36m⏱[0m  Monitoring logs: [1;33m 13s[0m / 900s | Log lines: [1;33m88[0m      [0;36m⏱[0m  Monitoring logs: [1;33m 14s[0m / 900s | Log lines: [1;33m88[0m      [0;36m⏱[0m  Monitoring logs: [1;33m 15s[0m / 900s | Log lines: [1;33m88[0m      [0;36m⏱[0m  Monitoring logs: [1;33m 16s[0m / 900s | Log lines: [1;33m88[0m      [0;36m⏱[0m  Monitoring logs: [1;33m 17s[0m / 900s | Log lines: [1;33m88[0m      [0;36m⏱[0m  Monitoring logs: [1;33m 18s[0m / 900s | Log lines: [1;33m88[0m      [0;36m⏱[0m  Monitoring logs: [1;33m 19s[0m / 900s | Log lines: [1;33m88[0m    
     ━━━━━━━━━━━━━━━━━━━━━━━━━━━━━━━━━━━━━━━ 899.8/899.8 MB 3.0 MB/s eta 0:00:00
Requirement already satisfied: jinja2 in /usr/local/lib/python3.10/dist-packages (from torch) (3.1.6)
Collecting nvidia-curand-cu12==10.3.9.90
  Downloading nvidia_curand_cu12-10.3.9.90-py3-none-manylinux_2_27_x86_64.whl (63.6 MB)
     ━━━━━━━━━━━━━━━━━━━━━━━━━━━━━━━━━━━━━━━━ 63.6/63.6 MB 28.2 MB/s eta 0:00:00
Collecting nvidia-cudnn-cu12==9.10.2.21
  Downloading nvidia_cudnn_cu12-9.10.2.21-py3-none-manylinux_2_27_x86_64.whl (706.8 MB)
  [0;36m⏱[0m  Monitoring logs: [1;33m 20s[0m / 900s | Log lines: [1;33m95[0m      [0;36m⏱[0m  Monitoring logs: [1;33m 21s[0m / 900s | Log lines: [1;33m95[0m      [0;36m⏱[0m  Monitoring logs: [1;33m 22s[0m / 900s | Log lines: [1;33m95[0m      [0;36m⏱[0m  Monitoring logs: [1;33m 23s[0m / 900s | Log lines: [1;33m95[0m      [0;36m⏱[0m  Monitoring logs: [1;33m 24s[0m / 900s | Log lines: [1;33m95[0m      [0;36m⏱[0m  Monitoring logs: [1;33m 25s[0m / 900s | Log lines: [1;33m95[0m      [0;36m⏱[0m  Monitoring logs: [1;33m 26s[0m / 900s | Log lines: [1;33m95[0m      [0;36m⏱[0m  Monitoring logs: [1;33m 27s[0m / 900s | Log lines: [1;33m95[0m      [0;36m⏱[0m  Monitoring logs: [1;33m 28s[0m / 900s | Log lines: [1;33m95[0m      [0;36m⏱[0m  Monitoring logs: [1;33m 29s[0m / 900s | Log lines: [1;33m95[0m    
     ━━━━━━━━━━━━━━━━━━━━━━━━━━━━━━━━━━━━━━━ 706.8/706.8 MB 4.2 MB/s eta 0:00:00
Collecting nvidia-cusparse-cu12==12.5.8.93
  Downloading nvidia_cusparse_cu12-12.5.8.93-py3-none-manylinux2014_x86_64.manylinux_2_17_x86_64.whl (288.2 MB)
     ━━━━━━━━━━━━━━━━━━━━━━━━━━━━━━━━━━━━━━━ 288.2/288.2 MB 9.3 MB/s eta 0:00:00
Collecting nvidia-nvtx-cu12==12.8.90
  Downloading nvidia_nvtx_cu12-12.8.90-py3-none-manylinux2014_x86_64.manylinux_2_17_x86_64.whl (89 kB)
     ━━━━━━━━━━━━━━━━━━━━━━━━━━━━━━━━━━━━━━━━ 90.0/90.0 KB 15.2 MB/s eta 0:00:00
Collecting nvidia-cusparselt-cu12==0.7.1
  Downloading nvidia_cusparselt_cu12-0.7.1-py3-none-manylinux2014_x86_64.whl (287.2 MB)
     ━━━━━━━━━━━━━━━━━━━━━━━━━━━━━━━━━━━━━━━ 287.2/287.2 MB 9.7 MB/s eta 0:00:00
Collecting nvidia-cuda-nvrtc-cu12==12.8.93
  Downloading nvidia_cuda_nvrtc_cu12-12.8.93-py3-none-manylinux2010_x86_64.manylinux_2_12_x86_64.whl (88.0 MB)
     ━━━━━━━━━━━━━━━━━━━━━━━━━━━━━━━━━━━━━━━━ 88.0/88.0 MB 23.8 MB/s eta 0:00:00
Collecting nvidia-nvshmem-cu12==3.3.20
  Downloading nvidia_nvshmem_cu12-3.3.20-py3-none-manylinux2014_x86_64.manylinux_2_17_x86_64.whl (124.7 MB)
     ━━━━━━━━━━━━━━━━━━━━━━━━━━━━━━━━━━━━━━ 124.7/124.7 MB 18.3 MB/s eta 0:00:00
Collecting fsspec>=0.8.5
  Downloading fsspec-2025.10.0-py3-none-any.whl (200 kB)
     ━━━━━━━━━━━━━━━━━━━━━━━━━━━━━━━━━━━━━━ 201.0/201.0 KB 32.6 MB/s eta 0:00:00
Collecting nvidia-cuda-runtime-cu12==12.8.90
  Downloading nvidia_cuda_runtime_cu12-12.8.90-py3-none-manylinux2014_x86_64.manylinux_2_17_x86_64.whl (954 kB)
     ━━━━━━━━━━━━━━━━━━━━━━━━━━━━━━━━━━━━━━ 954.8/954.8 KB 62.7 MB/s eta 0:00:00
  [0;36m⏱[0m  Monitoring logs: [1;33m 30s[0m / 900s | Log lines: [1;33m117[0m      [0;36m⏱[0m  Monitoring logs: [1;33m 31s[0m / 900s | Log lines: [1;33m117[0m      [0;36m⏱[0m  Monitoring logs: [1;33m 32s[0m / 900s | Log lines: [1;33m117[0m      [0;36m⏱[0m  Monitoring logs: [1;33m 33s[0m / 900s | Log lines: [1;33m117[0m      [0;36m⏱[0m  Monitoring logs: [1;33m 34s[0m / 900s | Log lines: [1;33m117[0m      [0;36m⏱[0m  Monitoring logs: [1;33m 35s[0m / 900s | Log lines: [1;33m117[0m      [0;36m⏱[0m  Monitoring logs: [1;33m 36s[0m / 900s | Log lines: [1;33m117[0m      [0;36m⏱[0m  Monitoring logs: [1;33m 37s[0m / 900s | Log lines: [1;33m117[0m      [0;36m⏱[0m  Monitoring logs: [1;33m 38s[0m / 900s | Log lines: [1;33m117[0m      [0;36m⏱[0m  Monitoring logs: [1;33m 39s[0m / 900s | Log lines: [1;33m117[0m    
Collecting nvidia-cuda-runtime-cu12==12.8.90
  Downloading nvidia_cuda_runtime_cu12-12.8.90-py3-none-manylinux2014_x86_64.manylinux_2_17_x86_64.whl (954 kB)
     ━━━━━━━━━━━━━━━━━━━━━━━━━━━━━━━━━━━━━━ 954.8/954.8 KB 62.7 MB/s eta 0:00:00
Collecting networkx>=2.5.1
  Downloading networkx-3.4.2-py3-none-any.whl (1.7 MB)
     ━━━━━━━━━━━━━━━━━━━━━━━━━━━━━━━━━━━━━━━━ 1.7/1.7 MB 66.4 MB/s eta 0:00:00
Collecting sympy>=1.13.3
  Downloading sympy-1.14.0-py3-none-any.whl (6.3 MB)
     ━━━━━━━━━━━━━━━━━━━━━━━━━━━━━━━━━━━━━━━━ 6.3/6.3 MB 77.6 MB/s eta 0:00:00
Collecting filelock
  Downloading filelock-3.20.0-py3-none-any.whl (16 kB)
Collecting nvidia-cublas-cu12==12.8.4.1
  Downloading nvidia_cublas_cu12-12.8.4.1-py3-none-manylinux_2_27_x86_64.whl (594.3 MB)
     ━━━━━━━━━━━━━━━━━━━━━━━━━━━━━━━━━━━━━━━ 594.3/594.3 MB 5.0 MB/s eta 0:00:00
Collecting nvidia-cufile-cu12==1.13.1.3
  Downloading nvidia_cufile_cu12-1.13.1.3-py3-none-manylinux2014_x86_64.manylinux_2_17_x86_64.whl (1.2 MB)
     ━━━━━━━━━━━━━━━━━━━━━━━━━━━━━━━━━━━━━━━━ 1.2/1.2 MB 70.4 MB/s eta 0:00:00
Collecting nvidia-nccl-cu12==2.27.5
  Downloading nvidia_nccl_cu12-2.27.5-py3-none-manylinux2014_x86_64.manylinux_2_17_x86_64.whl (322.3 MB)
  [0;36m⏱[0m  Monitoring logs: [1;33m 40s[0m / 900s | Log lines: [1;33m136[0m      [0;36m⏱[0m  Monitoring logs: [1;33m 41s[0m / 900s | Log lines: [1;33m136[0m      [0;36m⏱[0m  Monitoring logs: [1;33m 42s[0m / 900s | Log lines: [1;33m136[0m      [0;36m⏱[0m  Monitoring logs: [1;33m 43s[0m / 900s | Log lines: [1;33m136[0m      [0;36m⏱[0m  Monitoring logs: [1;33m 44s[0m / 900s | Log lines: [1;33m136[0m      [0;36m⏱[0m  Monitoring logs: [1;33m 45s[0m / 900s | Log lines: [1;33m136[0m      [0;36m⏱[0m  Monitoring logs: [1;33m 46s[0m / 900s | Log lines: [1;33m136[0m      [0;36m⏱[0m  Monitoring logs: [1;33m 47s[0m / 900s | Log lines: [1;33m136[0m      [0;36m⏱[0m  Monitoring logs: [1;33m 48s[0m / 900s | Log lines: [1;33m136[0m      [0;36m⏱[0m  Monitoring logs: [1;33m 49s[0m / 900s | Log lines: [1;33m136[0m    
     ━━━━━━━━━━━━━━━━━━━━━━━━━━━━━━━━━━━━━━━━ 10.2/10.2 MB 78.5 MB/s eta 0:00:00
Collecting nvidia-cufft-cu12==11.3.3.83
  Downloading nvidia_cufft_cu12-11.3.3.83-py3-none-manylinux2014_x86_64.manylinux_2_17_x86_64.whl (193.1 MB)
     ━━━━━━━━━━━━━━━━━━━━━━━━━━━━━━━━━━━━━━ 193.1/193.1 MB 11.3 MB/s eta 0:00:00
Collecting nvidia-cusolver-cu12==11.7.3.90
  Downloading nvidia_cusolver_cu12-11.7.3.90-py3-none-manylinux_2_27_x86_64.whl (267.5 MB)
     ━━━━━━━━━━━━━━━━━━━━━━━━━━━━━━━━━━━━━━ 267.5/267.5 MB 10.3 MB/s eta 0:00:00
Requirement already satisfied: typing-extensions>=4.10.0 in /usr/local/lib/python3.10/dist-packages (from torch) (4.13.2)
Collecting nvidia-nvjitlink-cu12==12.8.93
  Downloading nvidia_nvjitlink_cu12-12.8.93-py3-none-manylinux2010_x86_64.manylinux_2_12_x86_64.whl (39.3 MB)
     ━━━━━━━━━━━━━━━━━━━━━━━━━━━━━━━━━━━━━━━━ 39.3/39.3 MB 41.4 MB/s eta 0:00:00
Collecting triton==3.5.1
  Downloading triton-3.5.1-cp310-cp310-manylinux_2_27_x86_64.manylinux_2_28_x86_64.whl (170.3 MB)
  [0;36m⏱[0m  Monitoring logs: [1;33m 50s[0m / 900s | Log lines: [1;33m149[0m      [0;36m⏱[0m  Monitoring logs: [1;33m 51s[0m / 900s | Log lines: [1;33m149[0m      [0;36m⏱[0m  Monitoring logs: [1;33m 52s[0m / 900s | Log lines: [1;33m149[0m      [0;36m⏱[0m  Monitoring logs: [1;33m 53s[0m / 900s | Log lines: [1;33m149[0m      [0;36m⏱[0m  Monitoring logs: [1;33m 54s[0m / 900s | Log lines: [1;33m149[0m      [0;36m⏱[0m  Monitoring logs: [1;33m 55s[0m / 900s | Log lines: [1;33m149[0m      [0;36m⏱[0m  Monitoring logs: [1;33m 56s[0m / 900s | Log lines: [1;33m149[0m      [0;36m⏱[0m  Monitoring logs: [1;33m 57s[0m / 900s | Log lines: [1;33m149[0m      [0;36m⏱[0m  Monitoring logs: [1;33m 58s[0m / 900s | Log lines: [1;33m149[0m      [0;36m⏱[0m  Monitoring logs: [1;33m 59s[0m / 900s | Log lines: [1;33m149[0m    
  Downloading triton-3.5.1-cp310-cp310-manylinux_2_27_x86_64.manylinux_2_28_x86_64.whl (170.3 MB)
     ━━━━━━━━━━━━━━━━━━━━━━━━━━━━━━━━━━━━━━ 170.3/170.3 MB 15.2 MB/s eta 0:00:00
Collecting mpmath<1.4,>=1.1.0
  Downloading mpmath-1.3.0-py3-none-any.whl (536 kB)
     ━━━━━━━━━━━━━━━━━━━━━━━━━━━━━━━━━━━━━━ 536.2/536.2 KB 71.5 MB/s eta 0:00:00
Requirement already satisfied: MarkupSafe>=2.0 in /usr/local/lib/python3.10/dist-packages (from jinja2->torch) (3.0.2)
Installing collected packages: nvidia-cusparselt-cu12, mpmath, triton, sympy, nvidia-nvtx-cu12, nvidia-nvshmem-cu12, nvidia-nvjitlink-cu12, nvidia-nccl-cu12, nvidia-curand-cu12, nvidia-cufile-cu12, nvidia-cuda-runtime-cu12, nvidia-cuda-nvrtc-cu12, nvidia-cuda-cupti-cu12, nvidia-cublas-cu12, networkx, fsspec, filelock, nvidia-cusparse-cu12, nvidia-cufft-cu12, nvidia-cudnn-cu12, nvidia-cusolver-cu12, torch
  [0;36m⏱[0m  Monitoring logs: [1;33m 60s[0m / 900s | Log lines: [1;33m156[0m      [0;36m⏱[0m  Monitoring logs: [1;33m 61s[0m / 900s | Log lines: [1;33m156[0m      [0;36m⏱[0m  Monitoring logs: [1;33m 62s[0m / 900s | Log lines: [1;33m156[0m      [0;36m⏱[0m  Monitoring logs: [1;33m 63s[0m / 900s | Log lines: [1;33m156[0m      [0;36m⏱[0m  Monitoring logs: [1;33m 64s[0m / 900s | Log lines: [1;33m156[0m      [0;36m⏱[0m  Monitoring logs: [1;33m 65s[0m / 900s | Log lines: [1;33m156[0m      [0;36m⏱[0m  Monitoring logs: [1;33m 66s[0m / 900s | Log lines: [1;33m156[0m      [0;36m⏱[0m  Monitoring logs: [1;33m 67s[0m / 900s | Log lines: [1;33m156[0m      [0;36m⏱[0m  Monitoring logs: [1;33m 68s[0m / 900s | Log lines: [1;33m156[0m      [0;36m⏱[0m  Monitoring logs: [1;33m 69s[0m / 900s | Log lines: [1;33m156[0m      [0;36m⏱[0m  Monitoring logs: [1;33m 70s[0m / 900s | Log lines: [1;33m155[0m      [0;36m⏱[0m  Monitoring logs: [1;33m 71s[0m / 900s | Log lines: [1;33m155[0m      [0;36m⏱[0m  Monitoring logs: [1;33m 72s[0m / 900s | Log lines: [1;33m155[0m      [0;36m⏱[0m  Monitoring logs: [1;33m 73s[0m / 900s | Log lines: [1;33m155[0m      [0;36m⏱[0m  Monitoring logs: [1;33m 74s[0m / 900s | Log lines: [1;33m155[0m      [0;36m⏱[0m  Monitoring logs: [1;33m 75s[0m / 900s | Log lines: [1;33m155[0m      [0;36m⏱[0m  Monitoring logs: [1;33m 76s[0m / 900s | Log lines: [1;33m155[0m      [0;36m⏱[0m  Monitoring logs: [1;33m 77s[0m / 900s | Log lines: [1;33m155[0m      [0;36m⏱[0m  Monitoring logs: [1;33m 78s[0m / 900s | Log lines: [1;33m155[0m      [0;36m⏱[0m  Monitoring logs: [1;33m 79s[0m / 900s | Log lines: [1;33m155[0m      [0;36m⏱[0m  Monitoring logs: [1;33m 80s[0m / 900s | Log lines: [1;33m155[0m      [0;36m⏱[0m  Monitoring logs: [1;33m 81s[0m / 900s | Log lines: [1;33m155[0m      [0;36m⏱[0m  Monitoring logs: [1;33m 82s[0m / 900s | Log lines: [1;33m155[0m      [0;36m⏱[0m  Monitoring logs: [1;33m 83s[0m / 900s | Log lines: [1;33m155[0m      [0;36m⏱[0m  Monitoring logs: [1;33m 84s[0m / 900s | Log lines: [1;33m155[0m      [0;36m⏱[0m  Monitoring logs: [1;33m 85s[0m / 900s | Log lines: [1;33m155[0m      [0;36m⏱[0m  Monitoring logs: [1;33m 86s[0m / 900s | Log lines: [1;33m155[0m      [0;36m⏱[0m  Monitoring logs: [1;33m 87s[0m / 900s | Log lines: [1;33m155[0m      [0;36m⏱[0m  Monitoring logs: [1;33m 88s[0m / 900s | Log lines: [1;33m155[0m      [0;36m⏱[0m  Monitoring logs: [1;33m 89s[0m / 900s | Log lines: [1;33m155[0m      [0;36m⏱[0m  Monitoring logs: [1;33m 90s[0m / 900s | Log lines: [1;33m156[0m      [0;36m⏱[0m  Monitoring logs: [1;33m 91s[0m / 900s | Log lines: [1;33m156[0m      [0;36m⏱[0m  Monitoring logs: [1;33m 92s[0m / 900s | Log lines: [1;33m156[0m      [0;36m⏱[0m  Monitoring logs: [1;33m 93s[0m / 900s | Log lines: [1;33m156[0m      [0;36m⏱[0m  Monitoring logs: [1;33m 94s[0m / 900s | Log lines: [1;33m156[0m      [0;36m⏱[0m  Monitoring logs: [1;33m 95s[0m / 900s | Log lines: [1;33m156[0m      [0;36m⏱[0m  Monitoring logs: [1;33m 96s[0m / 900s | Log lines: [1;33m156[0m      [0;36m⏱[0m  Monitoring logs: [1;33m 97s[0m / 900s | Log lines: [1;33m156[0m      [0;36m⏱[0m  Monitoring logs: [1;33m 98s[0m / 900s | Log lines: [1;33m156[0m      [0;36m⏱[0m  Monitoring logs: [1;33m 99s[0m / 900s | Log lines: [1;33m156[0m    
Successfully installed filelock-3.20.0 fsspec-2025.10.0 mpmath-1.3.0 networkx-3.4.2 nvidia-cublas-cu12-12.8.4.1 nvidia-cuda-cupti-cu12-12.8.90 nvidia-cuda-nvrtc-cu12-12.8.93 nvidia-cuda-runtime-cu12-12.8.90 nvidia-cudnn-cu12-9.10.2.21 nvidia-cufft-cu12-11.3.3.83 nvidia-cufile-cu12-1.13.1.3 nvidia-curand-cu12-10.3.9.90 nvidia-cusolver-cu12-11.7.3.90 nvidia-cusparse-cu12-12.5.8.93 nvidia-cusparselt-cu12-0.7.1 nvidia-nccl-cu12-2.27.5 nvidia-nvjitlink-cu12-12.8.93 nvidia-nvshmem-cu12-3.3.20 nvidia-n
WARNING: Running pip as the 'root' user can result in broken permissions and conflicting behaviour with the system package manager. It is recommended to use a virtual environment instead: https://pip.pypa.io/warnings/venv
+ cd /workspace
+ wget -q -O ./agent https://downloads.silicondata.com/agent
+ chmod +x ./agent
+ echo '=== Setup Complete, Running Benchmark ==='
=== Setup Complete, Running Benchmark ===
+ ./agent -api-key eyJhbGciOiJIUzI1NiIsImtpZCI6IlNpbGljb25fe2NvZGV9IiwidHlwIjoiand0X2FwcF90b2tlbiJ9.eyJqb2JfaWQiOjE5OTU5ODE4NzI0Nzk0Nzc3NjAsImVtYWlsIjoidG9qYWlndXB0YUBnbWFpbC5jb20iLCJleHAiOjE3NjQ4MDA1MzZ9.m33aF8LyPKWrvW9dbX3pHe6E3ULt3ZXTl1KXoKQ96rw
Trace ID: f228332e856b0cddc9a13f788d795461
{"time":"2025-12-02T22:24:57.492340362Z","level":"INFO","msg":"Python executable verified: python3"}
  [0;36m⏱[0m  Monitoring logs: [1;33m100s[0m / 900s | Log lines: [1;33m166[0m      [0;36m⏱[0m  Monitoring logs: [1;33m101s[0m / 900s | Log lines: [1;33m166[0m      [0;36m⏱[0m  Monitoring logs: [1;33m102s[0m / 900s | Log lines: [1;33m166[0m      [0;36m⏱[0m  Monitoring logs: [1;33m103s[0m / 900s | Log lines: [1;33m166[0m      [0;36m⏱[0m  Monitoring logs: [1;33m104s[0m / 900s | Log lines: [1;33m166[0m      [0;36m⏱[0m  Monitoring logs: [1;33m105s[0m / 900s | Log lines: [1;33m166[0m      [0;36m⏱[0m  Monitoring logs: [1;33m106s[0m / 900s | Log lines: [1;33m166[0m      [0;36m⏱[0m  Monitoring logs: [1;33m107s[0m / 900s | Log lines: [1;33m166[0m      [0;36m⏱[0m  Monitoring logs: [1;33m108s[0m / 900s | Log lines: [1;33m166[0m      [0;36m⏱[0m  Monitoring logs: [1;33m109s[0m / 900s | Log lines: [1;33m166[0m    
{"time":"2025-12-02T22:25:02.220437364Z","level":"INFO","msg":"Packages verified: torch 2.9.1,pynvml 13.0.1,numpy 2.2.5"}
{"time":"2025-12-02T22:25:04.081793449Z","level":"INFO","msg":"Environment validated"}
{"time":"2025-12-02T22:25:04.42155499Z","level":"INFO","msg":"Benchmark quick_mark validated successfully"}
{"time":"2025-12-02T22:25:04.840600122Z","level":"INFO","msg":"QuickMark: Running system inventory"}
{"time":"2025-12-02T22:25:05.432947289Z","level":"INFO","msg":"Successfully parsed 1 GPU infos"}
{"time":"2025-12-02T22:25:06.137970298Z","level":"INFO","msg":"Collected location info: NL"}
  [0;36m⏱[0m  Monitoring logs: [1;33m110s[0m / 900s | Log lines: [1;33m172[0m      [0;36m⏱[0m  Monitoring logs: [1;33m111s[0m / 900s | Log lines: [1;33m172[0m      [0;36m⏱[0m  Monitoring logs: [1;33m112s[0m / 900s | Log lines: [1;33m172[0m      [0;36m⏱[0m  Monitoring logs: [1;33m113s[0m / 900s | Log lines: [1;33m172[0m      [0;36m⏱[0m  Monitoring logs: [1;33m114s[0m / 900s | Log lines: [1;33m172[0m      [0;36m⏱[0m  Monitoring logs: [1;33m115s[0m / 900s | Log lines: [1;33m172[0m      [0;36m⏱[0m  Monitoring logs: [1;33m116s[0m / 900s | Log lines: [1;33m172[0m      [0;36m⏱[0m  Monitoring logs: [1;33m117s[0m / 900s | Log lines: [1;33m172[0m      [0;36m⏱[0m  Monitoring logs: [1;33m118s[0m / 900s | Log lines: [1;33m172[0m      [0;36m⏱[0m  Monitoring logs: [1;33m119s[0m / 900s | Log lines: [1;33m172[0m      [0;36m⏱[0m  Monitoring logs: [1;33m120s[0m / 900s | Log lines: [1;33m172[0m      [0;36m⏱[0m  Monitoring logs: [1;33m121s[0m / 900s | Log lines: [1;33m172[0m      [0;36m⏱[0m  Monitoring logs: [1;33m122s[0m / 900s | Log lines: [1;33m172[0m      [0;36m⏱[0m  Monitoring logs: [1;33m123s[0m / 900s | Log lines: [1;33m172[0m      [0;36m⏱[0m  Monitoring logs: [1;33m124s[0m / 900s | Log lines: [1;33m172[0m      [0;36m⏱[0m  Monitoring logs: [1;33m125s[0m / 900s | Log lines: [1;33m172[0m      [0;36m⏱[0m  Monitoring logs: [1;33m126s[0m / 900s | Log lines: [1;33m172[0m      [0;36m⏱[0m  Monitoring logs: [1;33m127s[0m / 900s | Log lines: [1;33m172[0m      [0;36m⏱[0m  Monitoring logs: [1;33m128s[0m / 900s | Log lines: [1;33m172[0m      [0;36m⏱[0m  Monitoring logs: [1;33m129s[0m / 900s | Log lines: [1;33m172[0m    
{"time":"2025-12-02T22:25:32.295268203Z","level":"INFO","msg":"Collected complete system information"}
{"time":"2025-12-02T22:25:32.299416747Z","level":"INFO","msg":"Successfully executed action run_inventory for benchmark quick_mark"}
{"time":"2025-12-02T22:25:32.866917237Z","level":"INFO","msg":"QuickMark: Running GPU benchmark"}
{"time":"2025-12-02T22:25:32.902957998Z","level":"INFO","msg":"Data collected: GPU Count = 1"}
{"time":"2025-12-02T22:25:32.903025948Z","level":"INFO","msg":"Benchmarking GPU 0"}
  [0;36m⏱[0m  Monitoring logs: [1;33m130s[0m / 900s | Log lines: [1;33m177[0m      [0;36m⏱[0m  Monitoring logs: [1;33m131s[0m / 900s | Log lines: [1;33m177[0m      [0;36m⏱[0m  Monitoring logs: [1;33m132s[0m / 900s | Log lines: [1;33m177[0m      [0;36m⏱[0m  Monitoring logs: [1;33m133s[0m / 900s | Log lines: [1;33m177[0m      [0;36m⏱[0m  Monitoring logs: [1;33m134s[0m / 900s | Log lines: [1;33m177[0m      [0;36m⏱[0m  Monitoring logs: [1;33m135s[0m / 900s | Log lines: [1;33m177[0m      [0;36m⏱[0m  Monitoring logs: [1;33m136s[0m / 900s | Log lines: [1;33m177[0m      [0;36m⏱[0m  Monitoring logs: [1;33m137s[0m / 900s | Log lines: [1;33m177[0m      [0;36m⏱[0m  Monitoring logs: [1;33m138s[0m / 900s | Log lines: [1;33m177[0m      [0;36m⏱[0m  Monitoring logs: [1;33m139s[0m / 900s | Log lines: [1;33m177[0m      [0;36m⏱[0m  Monitoring logs: [1;33m140s[0m / 900s | Log lines: [1;33m177[0m      [0;36m⏱[0m  Monitoring logs: [1;33m141s[0m / 900s | Log lines: [1;33m177[0m      [0;36m⏱[0m  Monitoring logs: [1;33m142s[0m / 900s | Log lines: [1;33m177[0m      [0;36m⏱[0m  Monitoring logs: [1;33m143s[0m / 900s | Log lines: [1;33m177[0m      [0;36m⏱[0m  Monitoring logs: [1;33m144s[0m / 900s | Log lines: [1;33m177[0m      [0;36m⏱[0m  Monitoring logs: [1;33m145s[0m / 900s | Log lines: [1;33m177[0m      [0;36m⏱[0m  Monitoring logs: [1;33m146s[0m / 900s | Log lines: [1;33m177[0m      [0;36m⏱[0m  Monitoring logs: [1;33m147s[0m / 900s | Log lines: [1;33m177[0m      [0;36m⏱[0m  Monitoring logs: [1;33m148s[0m / 900s | Log lines: [1;33m177[0m      [0;36m⏱[0m  Monitoring logs: [1;33m149s[0m / 900s | Log lines: [1;33m177[0m      [0;36m⏱[0m  Monitoring logs: [1;33m150s[0m / 900s | Log lines: [1;33m177[0m      [0;36m⏱[0m  Monitoring logs: [1;33m151s[0m / 900s | Log lines: [1;33m177[0m      [0;36m⏱[0m  Monitoring logs: [1;33m152s[0m / 900s | Log lines: [1;33m177[0m      [0;36m⏱[0m  Monitoring logs: [1;33m153s[0m / 900s | Log lines: [1;33m177[0m      [0;36m⏱[0m  Monitoring logs: [1;33m154s[0m / 900s | Log lines: [1;33m177[0m      [0;36m⏱[0m  Monitoring logs: [1;33m155s[0m / 900s | Log lines: [1;33m177[0m      [0;36m⏱[0m  Monitoring logs: [1;33m156s[0m / 900s | Log lines: [1;33m177[0m      [0;36m⏱[0m  Monitoring logs: [1;33m157s[0m / 900s | Log lines: [1;33m177[0m      [0;36m⏱[0m  Monitoring logs: [1;33m158s[0m / 900s | Log lines: [1;33m177[0m      [0;36m⏱[0m  Monitoring logs: [1;33m159s[0m / 900s | Log lines: [1;33m177[0m      [0;36m⏱[0m  Monitoring logs: [1;33m160s[0m / 900s | Log lines: [1;33m177[0m      [0;36m⏱[0m  Monitoring logs: [1;33m161s[0m / 900s | Log lines: [1;33m177[0m      [0;36m⏱[0m  Monitoring logs: [1;33m162s[0m / 900s | Log lines: [1;33m177[0m      [0;36m⏱[0m  Monitoring logs: [1;33m163s[0m / 900s | Log lines: [1;33m177[0m      [0;36m⏱[0m  Monitoring logs: [1;33m164s[0m / 900s | Log lines: [1;33m177[0m      [0;36m⏱[0m  Monitoring logs: [1;33m165s[0m / 900s | Log lines: [1;33m177[0m      [0;36m⏱[0m  Monitoring logs: [1;33m166s[0m / 900s | Log lines: [1;33m177[0m      [0;36m⏱[0m  Monitoring logs: [1;33m167s[0m / 900s | Log lines: [1;33m177[0m      [0;36m⏱[0m  Monitoring logs: [1;33m168s[0m / 900s | Log lines: [1;33m177[0m      [0;36m⏱[0m  Monitoring logs: [1;33m169s[0m / 900s | Log lines: [1;33m177[0m      [0;36m⏱[0m  Monitoring logs: [1;33m170s[0m / 900s | Log lines: [1;33m177[0m      [0;36m⏱[0m  Monitoring logs: [1;33m171s[0m / 900s | Log lines: [1;33m177[0m      [0;36m⏱[0m  Monitoring logs: [1;33m172s[0m / 900s | Log lines: [1;33m177[0m      [0;36m⏱[0m  Monitoring logs: [1;33m173s[0m / 900s | Log lines: [1;33m177[0m      [0;36m⏱[0m  Monitoring logs: [1;33m174s[0m / 900s | Log lines: [1;33m177[0m      [0;36m⏱[0m  Monitoring logs: [1;33m175s[0m / 900s | Log lines: [1;33m177[0m      [0;36m⏱[0m  Monitoring logs: [1;33m176s[0m / 900s | Log lines: [1;33m177[0m      [0;36m⏱[0m  Monitoring logs: [1;33m177s[0m / 900s | Log lines: [1;33m177[0m      [0;36m⏱[0m  Monitoring logs: [1;33m178s[0m / 900s | Log lines: [1;33m177[0m      [0;36m⏱[0m  Monitoring logs: [1;33m179s[0m / 900s | Log lines: [1;33m177[0m    
{"time":"2025-12-02T22:26:22.374333549Z","level":"INFO","msg":"QuickMark benchmark completed successfully"}
{"time":"2025-12-02T22:26:22.374400039Z","level":"INFO","msg":"Successfully executed action run_benchmark for benchmark quick_mark"}
  [0;36m⏱[0m  Monitoring logs: [1;33m180s[0m / 900s | Log lines: [1;33m179[0m      [0;36m⏱[0m  Monitoring logs: [1;33m181s[0m / 900s | Log lines: [1;33m179[0m      [0;36m⏱[0m  Monitoring logs: [1;33m182s[0m / 900s | Log lines: [1;33m179[0m      [0;36m⏱[0m  Monitoring logs: [1;33m183s[0m / 900s | Log lines: [1;33m179[0m      [0;36m⏱[0m  Monitoring logs: [1;33m184s[0m / 900s | Log lines: [1;33m179[0m      [0;36m⏱[0m  Monitoring logs: [1;33m185s[0m / 900s | Log lines: [1;33m179[0m      [0;36m⏱[0m  Monitoring logs: [1;33m186s[0m / 900s | Log lines: [1;33m179[0m      [0;36m⏱[0m  Monitoring logs: [1;33m187s[0m / 900s | Log lines: [1;33m179[0m      [0;36m⏱[0m  Monitoring logs: [1;33m188s[0m / 900s | Log lines: [1;33m179[0m      [0;36m⏱[0m  Monitoring logs: [1;33m189s[0m / 900s | Log lines: [1;33m179[0m    
{"time":"2025-12-02T22:26:34.720624434Z","level":"INFO","msg":"Successfully completed agent execution"}
{"time":"2025-12-02T22:26:34.720678574Z","level":"INFO","msg":"GPU Benchmark completed successfully"}
{"time":"2025-12-02T22:26:34.720689824Z","level":"INFO","msg":"SiliconMark(TM) Agent execution complete"}
{
  "benchmark_results": {
    "quick_mark": {
      "benchmark_id": "quick_mark",
      "benchmark_name": "QuickMark",
      "config": {},
      "ended_at": "2025-12-02T22:26:22.374397Z",
      "error_message": null,
      "results": {
        "aggregate_results": {
          "bf16_tflops": 225.13,
          "device_to_host_bandwidth_gbs": 26.07,
          "fp16_tflops": 217.98,
          "fp32_cuda_core_tflops": 17.52,
          "fp32_tflops": 101.1,
          "gpu_id": "GPU-db342122-94b6-175e-30ea-bca1016c135c",
          "host_to_device_bandwidth_gbs": 26.68,
          "kernel_launch_overhead_us": 6.2,
          "l2_bandwidth_gbs": 387.7,
          "memory_bandwidth_gbs": 1384.37,
          "mixed_precision_tflops": 205.85,
          "power_consumption_watts": 321.69,
          "temperature_centigrade": 57
        },
        "test_results": [
          {
            "bf16_tflops": 225.13,
            "device_to_host_bandwidth_gbs": 26.07,
            "fp16_tflops": 217.98,
            "fp32_cuda_core_tflops": 17.52,
            "fp32_tflops": 101.1,
            "gpu_id": "GPU-db342122-94b6-175e-30ea-bca1016c135c",
            "host_to_device_bandwidth_gbs": 26.68,
            "kernel_launch_overhead_us": 6.2,
            "l2_bandwidth_gbs": 387.7,
            "memory_bandwidth_gbs": 1384.37,
            "mixed_precision_tflops": 205.85,
            "power_consumption_watts": 321.69,
            "temperature_centigrade": 57
          }
        ],
        "timestamp": "2025-12-02T22:26:22.374395849Z"
      },
      "started_at": "2025-12-02T22:25:32.866860Z",
      "state": "completed"
    }
  },
  "company_name": "OTCR",
  "configuration_id": "ecf5a6bf-28d2-50b6-9ef3-b8f94dfb32a8",
  "created_at": "2025-12-02T22:25:04.541187Z",
  "ended_at": "2025-12-02T22:26:27.684685Z",
  "failed_message": null,
  "gpu_count": 1,
  "gpu_model": "NVIDIA A100-SXM4-40GB",
  "id": "1995982576849920000",
  "inventory": {
    "config_id": "ecf5a6bf-28d2-50b6-9ef3-b8f94dfb32a8",
    "cpu": {
      "arch": "x86_64",
      "count": 30,
      "os": "ubuntu 22.04",
      "processor": "AMD EPYC 7543 32-Core Processor",
      "virtualization_type": "guest"
    },
    "disk": {
      "model": "",
      "size_gb": 3174,
      "technology": "HDD"
    },
    "gpu": {
      "count": 1,
      "cuda_version": "12.7",
      "driver_version": "565.57.01",
      "memory_gb": 40,
      "model": "NVIDIA A100-SXM4-40GB",
      "network_type": null,
      "vendor": "NVIDIA"
    },
    "location": "NL",
    "machine_id": "8ddfc676-ce27-5509-a5fa-3b3952532940",
    "memory": {
      "total_gb": 212,
      "type": "Unknown"
    },
    "network": {
      "download_speed_mbps": 922,
      "machine_ip": "172.17.0.3",
      "open_ports": 2,
      "upload_speed_mbps": 916
    }
  },
  "job_id": "1995981872479477760",
  "machine_ip": null,
  "machine_uuid": "8ddfc676-ce27-5509-a5fa-3b3952532940",
  "manufacturer_gpu_spec": {
    "bandwidth": "1560.0",
    "fp16": "77.97",
    "fp32": "19.49"
  },
  "pdf_report_url": "s3://sd-siliconmark-output/O006/1995981872479477760/pdf_reports/1995982576849920000.pdf",
  "started_at": "2025-12-02T22:25:04.537753Z",
  "state": "completed"
}
+ echo '=== QUICKMARK_BENCHMARK_COMPLETE ==='
=== QUICKMARK_BENCHMARK_COMPLETE ===

[0;32m[SUCCESS][0m Benchmark complete detected in logs!

[0;32m[SUCCESS][0m Benchmark completed!

[0;36m════════════════════════════════════════[0m
[0;36m  Step 6: Parsing and Saving Results[0m
[0;36m════════════════════════════════════════[0m
[0;34m[INFO][0m Raw result saved to siliconmark_output.json
[0;32m[SUCCESS][0m Benchmark Results:
  [0;36mGPU:[0m               NVIDIA A100-SXM4-40GB (x1)
  [0;36mBF16 TFLOPS:[0m       225.13
  [0;36mFP16 TFLOPS:[0m       217.98
  [0;36mFP32 TFLOPS:[0m       101.1
  [0;36mMixed Precision:[0m   205.85 TFLOPS
  [0;36mMemory BW:[0m         1384.37 GB/s
  [0;36mPower:[0m             321.69 W
  [0;36mTemperature:[0m       57 °C
[0;32m[SUCCESS][0m Results appended to /Users/jai/Documents/GitHub/vastai/quickmark_results.json

[0;36m════════════════════════════════════════[0m
[0;36m  Step 7: Destroying Instance[0m
[0;36m════════════════════════════════════════[0m
[0;34m[INFO][0m Destroying instance 28442939...
null
[0;32m[SUCCESS][0m Instance destroyed

[0;36m════════════════════════════════════════[0m
[0;36m  Benchmark Complete![0m
[0;36m════════════════════════════════════════[0m
[0;32mSummary:[0m
  Machine ID:      34282
  GPU:             NVIDIA A100-SXM4-40GB
  QuickMark Score: [0;32m225.13[0m BF16 TFLOPS
  DLPerf:          95.44098961204517
  Results saved:   /Users/jai/Documents/GitHub/vastai/quickmark_results.json

[0;36mTip:[0m Refresh your dashboard to see the new data point!
